,Unnamed: 0,Name,Years,Age,Duration,Rating,VoteCount,Summary,Review_Count,Seasons,Star1,Star2,Star3,EpisodeCount,baslangic,isFinal,Sınıf,EpsPerSeason,Action,Adventure,Animation,Biography,Comedy,Crime,Documentary,Drama,Family,Game-Show,History,Music,News,Reality-TV,Romance,Sci-Fi,Short,Sport,Talk-Show,others,HasLove,HasFamily,HasIstanbul,Basrol_Class1,Basrol_Class2,Basrol_Class3,Basrol_Class4
848,861,Ögretmen Kemal,2010–2011,7.0,83.0,5.3,38000.0,Devoted teacher Professor Kemal tries to be the positive force on wealthy high school students' lives. Sudden death of one student makes Professor Kemal very suspicious. And he starts investigating the case.,4.0,2.0,Sönmez Atasoy,Fadik Sevin Atasoy,Kenan Çoban,13.0,2010,1,2,6.0,0,0,0,0,0,0,0,1,0,0,0,0,0,0,0,0,0,0,0,0,0,0,0,0,0,0,0
849,862,Türk Mali,2017,7.0,120.0,2.7,276000.0,"It is the 2nd version of Türk Mali. The new life of Erman Kuzu, who is divorced from Abiye, is told in the series.",2.0,2.0,Erdal Besikçioglu,Kaan Urgancioglu,Osman Kot,13.0,2017,0,2,6.0,0,0,0,0,1,0,0,0,0,0,0,0,0,0,0,0,0,0,0,0,0,0,0,0,0,0,0
850,863,Vurgun,2019,7.0,83.0,5.1,156000.0,The series is about the story of Kemal waking from a coma ten years later.,4.0,2.0,Sönmez Atasoy,Fadik Sevin Atasoy,Kenan Çoban,13.0,2019,0,2,6.0,0,0,0,0,0,0,0,1,0,0,0,0,0,0,0,0,0,0,0,0,0,0,0,0,0,0,0
851,864,Ne Münasebet,2015,7.0,83.0,5.7,83000.0,a man and a woman who are constantly fighting each other but still have to work together.,2.0,2.0,Eser Yenenler,Oguzhan Koç,Ibrahim Büyükak,13.0,2015,0,2,6.0,0,0,0,0,1,0,0,0,0,0,0,0,0,0,0,0,0,0,0,0,0,0,0,0,1,0,0
852,865,Askin Halleri,2012,7.0,83.0,4.9,11000.0,Unknown,2.0,2.0,Keremcem,Yasemin Ergene,Kuzey Vargin,11.0,2012,0,2,6.0,0,0,0,0,1,0,0,0,0,0,0,0,0,0,0,0,0,0,0,0,0,0,0,0,0,0,0
853,866,Karakol,2011,7.0,83.0,6.1,97000.0,"The Ministry of the Interior develops a new project on the increase in the crime rate. Previously dismissed, with different forms of work, but capable policemen to work again. A pilot unit is launched for this. A special unit called the ""operation team"" is stationed in a locality with the highest crime rate in Istanbul.",10.5,2.0,,,,13.0,2011,0,2,6.0,1,0,0,0,0,0,0,0,0,0,0,0,0,0,0,0,0,0,0,0,0,0,1,0,0,0,0
854,867,Sevgili Dünürüm,2007–2008,7.0,83.0,6.1,221000.0,"The story of the hilarious clashes between two in-laws, the rich but graceless Ahmet and teacher Yildiz; and the intense efforts of their children who are married to keep the two families together.",2.0,2.0,Erdal Besikçioglu,Nur Fettahoglu,Tuvana Türkay,8.0,2007,1,2,4.0,0,0,0,0,1,0,0,0,0,0,0,0,0,0,0,0,0,0,0,0,0,1,0,0,1,0,0
855,868,Kayip Prenses,2008–2017,7.0,83.0,5.7,58500.0,"Defne, a fairy girl, falls in love with a person when she comes to earth to do good. Their love is irreplaceable, unforgettable and irreplaceable. For the sake of this love, the fairy gives up immortality, infinite powers, being the Queen of the fairy world. She chooses to live on earth as an ordinary human being.",2.0,2.0,Yekta Kopan,Levent Kol,,70.0,2008,1,2,35.0,0,0,0,0,1,0,0,0,0,0,0,0,0,0,0,0,0,0,0,0,1,1,0,0,0,0,0
856,870,Bizim Okul,2013,7.0,83.0,2.8,97000.0,"A school of life where students learn new lessons in lessons, at the same time have fun together, build solid friendships, learn to be with their friends during difficult times. The 10-A class, where the disgruntled students of the school come together, is the fear of the teachers.",2.0,2.0,Yekta Kopan,Levent Kol,,70.0,2013,0,2,35.0,0,0,0,0,1,0,0,0,0,0,0,0,0,0,0,0,0,0,0,0,0,1,0,0,0,0,0
857,872,Ibi,2015,7.0,83.0,6.6,69000.0,"Ibi and her best friend, Tosi the turtle, go on a variety of adventures in Baldiyar, learn new things and solve others' problems using math and critical thinking while making friends along the way.",7.0,3.0,Hakan Boyav,Kenan Çoban,Ali Sürmeli,6.0,2015,0,3,2.0,0,0,1,0,0,0,0,0,0,0,0,0,0,0,0,0,0,0,0,0,0,0,0,0,0,1,0
858,873,Güldüy Güldüy Show Çocuk,2016–2017,7.0,83.0,4.4,75000.0,Do you want to see the sketches of Güldür Güldür Show from children's world?,2.0,2.0,Nur Fettahoglu,Engin Öztürk,Ipek Karapinar,13.0,2016,1,2,6.0,0,0,0,0,1,0,0,0,0,0,0,0,0,0,0,0,0,0,0,0,0,1,0,0,1,0,0
859,874,Üvey Baba,1998–2004,7.0,83.0,5.6,115000.0,"Halil, who is a relentless stepfather to two daughters, leeches off his family and never stops getting his family into troubles because of monetary issues.",4.0,2.0,Tugay Inanoglu,,,8.0,1998,1,2,4.0,0,0,0,0,0,0,0,1,0,0,0,0,0,0,0,0,0,0,0,0,0,1,0,0,0,0,0
860,875,Bay Kamber,1994,7.0,83.0,6.6,513749.99999999977,"Kamber served as a police officer for many years. In this process, he infuriated his superiors with his incompetence, ignorance and stupidity. One day, his superior finally convinces him to retire and he achieves his goal of getting rid of him, but it cannot be said that he got rid of him completely.",2.0,2.0,Bülent Kayabas,Tülay Bursa,Keremcan Köse,80.0,1994,0,2,40.0,0,0,0,0,1,0,0,0,0,0,0,0,0,0,0,0,0,0,0,0,0,0,0,0,0,0,0
861,876,Otisabi,2013,7.0,83.0,7.0,230000.0,Adventures of a chronic bachelor in Istanbul who narrates his various experiences with women.,2.0,2.0,Kemal Dogulu,Ugurkan Erez,Seray Sever,13.0,2013,0,2,6.0,0,0,0,0,1,0,0,0,0,0,0,0,0,0,0,0,0,0,0,0,0,0,1,1,0,0,0
862,877,Kaynanalar,1974–2005,7.0,83.0,6.9,453000.0,"Nuri Kantar and his family migrate from Anatolia to Istanbul. While family members continue their traditional lives, they also try to keep up with the rules of the big city.",2.0,4.5,Fikret Kuskan,Senay Gürler,Arif Erkin Güzelbeyoglu,46.0,1974,1,3,9.0,0,0,0,0,1,0,0,0,0,0,0,0,0,0,0,0,0,0,0,0,0,1,1,0,0,0,0
863,878,Yalan Dünya,2007,7.0,83.0,5.0,58000.0,Unknown,2.0,2.0,Saruhan Hünel,Arkin Gelenbe,Emel Pala,101.0,2007,0,2,45.0,0,0,0,0,1,0,0,0,0,0,0,0,0,0,0,0,0,0,0,0,0,0,0,0,0,0,0
864,879,Mahallenin Muhtarlari,1992–2002,7.0,83.0,6.1,1100.0,"Friendships, love, resentment, family fights in a loving neighborhood, and dozens of events that are always sweet, even if painful.",1.0,2.0,Kerim Afsar,Erol Alpsoykan,Özlem Argon,13.0,1992,1,2,6.0,0,0,0,0,1,0,0,0,0,0,0,0,0,0,0,0,0,0,0,0,1,1,0,0,0,0,0
865,880,Türk Mali,2010–2011,7.0,83.0,3.6,1400.0,Erman and Abiye are married for twenty years and are very squeezed together. They have to tolerate each other. Their life becomes more difficult with two troubled children and a brother-in-law. The life of the Kuzu Family changes with the neighbors moved to the side of the building.,2.0,2.0,Oktay Kaynarca,Öykü Celik,Meltem Cumbul,4.0,2010,1,2,2.0,0,0,0,0,1,0,0,0,0,0,0,0,0,0,0,0,0,0,0,0,0,1,0,1,0,1,0
866,881,Iki Yalanci,2017,7.0,83.0,4.8,118000.0,What if two liars get together?,1.0,2.0,Nik Xhelilaj,Elif Atakan,Devrim Evin,4.0,2017,0,2,2.0,0,0,0,0,1,0,0,0,0,0,0,0,0,0,0,0,0,0,0,0,0,0,0,0,0,0,0
867,882,Serce Sarayi,2015,7.0,83.0,5.4,81000.0,Unknown,4.0,2.0,Ipek Karapinar,Sahra Sas,Emel Göksu,24.0,2015,0,2,12.0,0,0,0,0,0,0,0,1,0,0,0,0,0,0,0,0,0,0,0,0,0,0,0,0,0,0,0
868,883,Söhret,2005–2007,7.0,83.0,3.5,129000.0,The story of a poor girl who takes revenge on the man she loves after becoming famous.,4.0,2.0,Ahmet Kayakesen,Gizem Sevim,Goncagül Sunar,13.0,2005,1,2,6.0,0,0,0,0,0,0,0,0,0,0,0,0,0,0,1,0,0,0,0,0,1,0,0,0,1,0,0
869,884,Yalaza,2017–2018,7.0,83.0,5.1,46000.0,"Ibrahim does not have much of a problem except for his four grown daughters, three wacky groom-to-be, his senile father, his naughty little son. Until that ""most important day"" of his life comes.",2.0,2.0,Atakan Hosgören,Rami Narin,Atabik Mohsin,8.0,2017,1,2,4.0,0,0,0,0,1,0,0,0,0,0,0,0,0,0,0,0,0,0,0,0,0,1,0,0,0,0,0
870,885,Yol Ayrimi,2012–2013,7.0,83.0,5.4,302000.0,"Yol Ayrimi adapted from Kemal Tahir's book of the same takes place in 1930's Turkey. The homeland, which hundreds of thousands of people saved in the War of Independence, is now fighting for democracy.",2.0,2.0,Barkin Senüren,,,98.0,2012,1,2,45.0,0,0,0,0,0,0,0,1,0,0,0,0,0,0,0,0,0,0,0,0,0,0,0,0,0,0,0
871,886,Zehirli Çiçek,2000,7.0,83.0,3.0,38000.0,"Nazan, Nilgün and Aysin are very close friends and they spend their childhood together. Each of them has their own revenge regarding the past.",4.0,2.0,Hakan Kandal,,,20.0,2000,0,2,10.0,0,0,0,0,0,0,0,1,0,0,0,0,0,0,0,0,0,0,0,0,0,0,0,0,0,0,0
872,887,Veda,2012,7.0,83.0,5.7,63000.0,"In the story set in 1920s Istanbul, an impossible love blossoming in the mansion of Minister of Finance Mehmet Resat Bey. Will the adopted Mehpare and Kemal be able to live a free love in a captive city?",16.0,2.0,Hakan Kandal,,,2.0,2012,0,2,1.0,0,0,0,1,0,0,0,0,0,0,0,0,0,0,0,0,0,0,0,1,1,0,1,0,0,0,0
873,888,Yalnizim Mesut Bey,2022– ,7.0,83.0,8.0,161000.0,"A new format with Mesut Süre, which has drawn a unique and pioneering path both in the world of humor and in the field of talk shows. Mesut Süre talks to the lonely, about loneliness, the reasons for loneliness, whether loneliness is ""sultanism"" or ""desperation"", over the loneliness of his guests - in his own words - ""making people laugh like a bear"".",1.0,3.0,Hakan Kandal,,,20.0,2022,0,3,7.0,0,0,0,0,0,0,0,0,0,0,0,0,0,0,0,0,0,0,1,0,0,1,0,0,0,0,0
874,889,Görüs Günü Kadinlari,2013,7.0,83.0,5.4,67000.0,Unknown,4.0,2.0,Hakan Kandal,,,2.0,2013,0,2,1.0,0,0,0,0,0,0,0,1,0,0,0,0,0,0,0,0,0,0,0,0,0,0,0,0,0,0,0
875,890,Doludizgin Yillar,2008,7.0,83.0,6.0,117000.0,"Baris is a 19-year-old law student. He has always studied in the best schools, and all his student life has tried to win these schools. But it looks like the Peace family is moving towards becoming a young man, as the family wants, but it is not as it seems.",4.0,2.0,Gürgen Öz,Begüm Kütük,Saruhan Hünel,17.0,2008,0,2,8.0,0,0,0,0,0,0,0,1,0,0,0,0,0,0,0,0,0,0,0,0,0,1,0,1,0,0,0
876,891,Asli ile Kerem,2002,7.0,83.0,6.6,394000.0,"Aslý and Kerem, two young people from different parts of the society, get married one week after they meet. The differences in this young couple's lives turn into enjoyable memories thanks to their love for each other. This lovely comedy serial was watched with fun for weeks.",2.0,2.0,Melek Baykal,Seyfi Dursunoglu,Ferhat Bora,3.0,2002,0,2,2.0,0,0,0,0,1,0,0,0,0,0,0,0,0,0,0,0,0,0,0,0,1,0,0,0,0,1,0
877,892,Hirsiz Polis,2005–2007,7.0,83.0,6.5,513749.99999999977,"An impossible love story between Mavi, a thief, and Cinar, a police officer.",2.0,2.0,Gürgen Öz,Begüm Kütük,Saruhan Hünel,17.0,2005,1,2,8.0,0,1,0,0,0,0,0,0,0,0,0,0,0,0,0,0,0,0,0,0,1,0,0,1,0,0,0
878,893,Benimle Söyle,2019–2020,7.0,83.0,5.1,55000.0,Unknown,1.0,2.0,Melek Baykal,Seyfi Dursunoglu,Ferhat Bora,3.0,2019,1,2,2.0,0,0,0,0,0,0,0,0,0,1,0,0,0,0,0,0,0,0,0,0,0,0,0,0,0,1,0
879,894,Survivor 2020,2020,7.0,83.0,3.4,215000.0,Survivor 2020 is the fourteenth upcoming season of the Survivor to air in Turkey.,1.0,2.0,Nebahat Çehre,Hazal Kaya,Asli Tandogan,13.0,2020,0,2,6.0,0,0,0,0,0,0,0,0,0,0,0,0,0,1,0,0,0,0,0,0,0,1,0,0,1,0,0
880,895,Yeter Anne,2002,7.0,83.0,7.9,244000.0,"Makbule, who has a disease of forgetfulness, has two sons. Altan lives with his mother and is a man who does not have a job. No matter what he does, he can't be good to his mother either.",2.0,2.0,Hümeyra,Avni Yalçin,Özge Özpirinçci,1.0,2002,0,2,0.0,0,0,0,0,1,0,0,0,0,0,0,0,0,0,0,0,0,0,0,0,0,1,0,1,0,0,0
881,896,Akinci,2021,7.0,120.0,2.3,1300.0,The struggle of a modern hero who takes his roots in Ottoman history and protects his city and its people at the cost of his life.,22.5,2.0,Güven Hokna,Serkan Kuru,Orhan Aydin,19.0,2021,0,2,10.0,1,0,0,0,0,0,0,0,0,0,0,0,0,0,0,0,0,0,0,0,0,0,0,0,0,1,0
882,897,Klavye Delikanlilari,2017,7.0,83.0,7.4,319000.0,"Bayram and Kerem are two close friends who became asocial as they could not have had much dialogue with people since their early ages and spend all their time on the computer. They used computers to express what they could not say to the hundreds and make money on it. Cousin Volki, Bayram's cousin, has returned from America.",2.0,2.0,Yavuz Bingöl,Deniz Ugur,Ali Ersan Duru,9.0,2017,0,2,4.0,0,0,0,0,1,0,0,0,0,0,0,0,0,0,0,0,0,0,0,0,0,0,0,0,0,0,0
883,898,Çifte Bela,2001,7.0,83.0,3.8,82000.0,"Fatmagül and Aysegül, who are madly jealous of their father, have no intention of losing him to anyone. Every time their dad comes out with a new candidate, they do everything they can to mess things up.",2.0,2.0,Merih Aslan,,,10.0,2001,0,2,5.0,0,0,0,0,1,0,0,0,0,0,0,0,0,0,0,0,0,0,0,0,0,1,0,0,0,0,0
884,899,Osmanlida Derin Devlet,2013,7.0,83.0,5.7,83000.0,"In 1711, the Ottoman Empire defeated the Russian Empire and entered a period of stagnation. The story begins with Patrona Halil's brother hanging with the order of the sultan. The Ottomans got away from the war and organized more fun in the tulips gardens. The opponents of the Janissaries and some anti-Sultan gangs trying to organize can not dare a rebel.",10.5,2.0,Oya Basar,Tarik Ünlüoglu,Dolunay Soysert,64.0,2013,0,2,32.0,1,0,0,0,0,0,0,0,0,0,0,0,0,0,0,0,0,0,0,0,0,0,0,1,0,0,0
885,900,Askimiz Yeter,2023– ,7.0,83.0,5.8,26000.0,"A newly married couple clings to each other in the morning of each night, and by getting strength from their love, they manage to overcome every unpleasantness.",2.0,2.0,Bülent Emrah Parlak,Burak Kut,Gözde Kansu,13.0,2023,0,2,6.0,0,0,0,0,1,0,0,0,0,0,0,0,0,0,0,0,0,0,0,0,1,0,0,1,0,0,0
886,901,Camdan Pabuçlar,2004,7.0,83.0,3.7,74000.0,"Story of Gönül, who is a successful, beautiful woman in her mid-thirties.",2.0,2.0,,,,13.0,2004,0,2,6.0,0,0,0,0,1,0,0,0,0,0,0,0,0,0,0,0,0,0,0,0,0,0,0,0,0,0,0
887,903,Mayis Kraliçesi,2015–2016,7.0,83.0,5.0,68000.0,Nehir is young girl who works in a shipbuilding industry.,1.0,2.0,Bülent Inal,Melis Birkan,Okan Yalabik,17.0,2015,1,2,8.0,0,0,0,0,0,0,0,1,0,0,0,0,0,0,0,0,0,0,0,0,0,0,0,1,0,0,0
888,904,Pars: Narkoterör,2008,7.0,83.0,4.6,205000.0,"When Samil, a police, goes on a family visit to Van with his colleague and fiancee Zuluf, he finds himself in the middle of drug lords.",10.5,2.0,Songül Öden,Nihal Yalçin,Canan Erguder,15.0,2008,0,2,8.0,1,0,0,0,0,0,0,0,0,0,0,0,0,0,0,0,0,0,0,0,0,1,0,1,0,0,0
889,905,GIF,2018,7.0,83.0,3.9,17000.0,Unknown,2.0,2.0,Funda Güray,Baran Akbulut,Ferit Kaya,10.0,2018,0,2,5.0,0,0,0,0,1,0,0,0,0,0,0,0,0,0,0,0,0,0,0,0,0,0,0,0,1,0,0
890,906,Niloya,2014–2015,7.0,83.0,6.1,96000.0,Unknown,2.0,3.0,Mehmet Aslantug,Idil Firat,Birce Akalay,15.0,2014,1,3,5.0,0,0,1,0,0,0,0,0,0,0,0,0,0,0,0,0,0,0,0,0,0,0,0,0,1,0,0
891,907,Firuze,2013,7.0,83.0,4.9,37000.0,What happened to this show ?? Why it stopped it was good show can someone tell us what happened and where and how can I watch it??,4.0,2.0,Yusuf Çim,Ismail Filiz,Ruveyda Öksuz,2.0,2013,0,2,1.0,0,0,0,0,0,0,0,1,0,0,0,0,0,0,0,0,0,0,0,0,0,0,0,0,1,0,0
892,908,Eksi 18,2006,7.0,83.0,4.4,35000.0,"Society fingers a bleeding struggle; Child Crimes. Today, as the streets become more dangerous and the crime rates in the world are increasing rapidly, the bold and sacrificial policemen of the Children's Division of the Police Department pursue the events that deeply shake the audience.",10.5,2.0,Ibrahim Selim,Buse Kara,Mert Efe Günaydin,101.0,2006,0,2,45.0,1,0,0,0,0,0,0,0,0,0,0,0,0,0,0,0,0,0,0,0,0,1,0,0,0,0,0
893,909,Benzemez Kimse Sana,2012–2015,7.0,83.0,6.6,40000.0,Unknown,1.0,3.0,Bergüzar Korel,Bülent Inal,Tuncer Salman,32.0,2012,1,3,11.0,0,0,0,0,0,0,0,0,0,1,0,0,0,0,0,0,0,0,0,0,0,0,0,0,0,0,0
894,910,Hiçkirik,2018,7.0,83.0,4.6,27000.0,"Kenan has endured years of pain and suffering in the orphanage, but finally Azmi Karaoglu, one of the Istanbul's wealthiest businessmen, has found and rescued him and brought him to his own place. The one who really changed Kenan's life was Nalan, whom Kenan had met at home while still a child.",4.0,2.0,Damla Sönmez,Mert Firat,Tülin Özen,6.0,2018,0,2,3.0,0,0,0,0,0,0,0,1,0,0,0,0,0,0,0,0,0,0,0,0,0,0,1,1,0,0,0
895,911,Dans Eder misin?,2005–2011,7.0,83.0,6.6,31000.0,Unknown,1.0,4.5,Yildiz Kenter,Can Gürzap,Basak Köklükaya,26.0,2005,1,4,4.0,0,0,0,0,0,0,0,0,0,1,0,0,0,0,0,0,0,0,0,0,0,0,0,0,1,0,0
896,912,Pasa Baba Konagi,2000,7.0,83.0,5.7,58500.0,Unknown,2.0,2.0,Damla Sönmez,Mert Firat,Tülin Özen,6.0,2000,0,2,3.0,0,0,0,0,1,0,0,0,0,0,0,0,0,0,0,0,0,0,0,0,0,0,0,1,0,0,0
897,913,Kirik Ayna,2002–2003,7.0,83.0,5.7,46000.0,"Longing for a son, Candar organizes a festival in the village when he learns that his new wife, Ceren, is pregnant with a baby boy. Candar is unaware of the insidious plans of his enemy Ali Kirman.",4.0,2.0,Yildiz Kenter,Can Gürzap,Basak Köklükaya,13.0,2002,1,2,6.0,0,0,0,0,0,0,0,1,0,0,0,0,0,0,0,0,0,0,0,0,0,1,0,0,1,0,0
898,914,Ümit Milli,2006,7.0,83.0,5.4,92000.0,A coming of age story of adolescence thrills.,2.5,3.0,Talat Bulut,Vahide Perçin,Duygu Yetis,64.0,2006,0,3,21.0,0,1,0,0,0,0,0,0,0,0,0,0,0,0,0,0,0,0,0,0,0,0,0,0,0,1,0
899,915,Yusuf Yüzlü,2004–2015,7.0,83.0,5.5,35000.0,Unknown,4.0,2.0,Haluk Bilginer,Yildiz Asyali,Ugur Kivilcim,34.0,2004,1,2,17.0,0,0,0,0,0,0,0,1,0,0,0,0,0,0,0,0,0,0,0,0,0,0,0,0,0,0,1
900,916,Kurulus,1986– ,7.0,83.0,8.1,277000.0,"The epic story of Osman Gazi, founder of Ottoman Empire, from his early years to his death, based on the novel by Tarik Bugra.",2.0,2.0,Cemre Kemer,Eren Bakici,Gülçin Ergül,51.0,1986,0,2,26.0,0,0,0,0,0,0,0,0,0,0,1,0,0,0,0,0,0,0,0,1,0,0,0,0,0,0,0
901,917,Aksam Günesi,1999,7.0,83.0,5.5,48000.0,Unknown,4.0,2.0,Okan Yalabik,Emre Altug,Bülent Sakrak,26.0,1999,0,2,13.0,0,0,0,0,0,0,0,0,0,0,0,0,0,0,1,0,0,0,0,0,0,0,0,0,0,0,0
902,918,Dügün Sarkicisi,2008,7.0,83.0,5.9,95000.0,"Bayram, who came to Istanbul from the countryside to become a famous singer, starts working as a singer at a wedding saloon.",2.0,2.0,Mehmet Ali Erbil,Levent Üzümcü,Gamze Karaman,32.0,2008,0,2,16.0,0,0,0,0,1,0,0,0,0,0,0,0,0,0,0,0,0,0,0,0,0,0,1,1,0,1,0
903,919,Perihan Abla,1986–1988,7.0,45.0,7.7,1200.0,Slice-of-life comedy focusing on daily lives of a woman and a man who is desperately in love with her and all the surrounding people in the neighborhood.,2.0,2.0,Oktay Çubuk,Nil Keser,Derya Alabora,7.0,1986,1,2,4.0,0,0,0,0,1,0,0,0,0,0,0,0,0,0,0,0,0,0,0,0,1,0,0,0,0,1,0
904,920,Gecenin Öteki Yüzü,1987,7.0,83.0,7.2,99000.0,It is the story of a sad woman who got married despite the opposition of her wealthy family and was depressed after the death of her beloved husband and trying to hold on to life in the back streets of Istanbul with her little daughter.,4.0,2.0,Furkan Palali,Tolga Güleç,Sultan Ulutas,13.0,1987,0,2,6.0,0,0,0,0,0,0,0,1,0,0,0,0,0,0,0,0,0,0,0,0,1,1,1,1,0,0,0
905,921,Var misin? Yok musun?,2007–2017,7.0,83.0,2.7,234000.0,Unknown,1.0,2.0,Berk Oktay,Nehir Erdogan,Füsun Demirel,36.0,2007,1,2,18.0,0,0,0,0,0,0,0,0,0,1,0,0,0,0,0,0,0,0,0,0,0,0,0,0,1,0,1
906,922,Canan,2011,7.0,83.0,5.4,81000.0,"The life of Canan, who was adopted as a little girl, turns into a nightmare on New Year's Eve. Years later, as a strong, ruthless and rich woman, Canan returns to take revenge to face those who stole her innocence.",4.0,2.0,Öner Erkan,Caner Özyurtlu,Ayse Melike Çerçi,14.0,2011,0,2,7.0,0,0,0,0,0,0,0,1,0,0,0,0,0,0,0,0,0,0,0,0,0,0,0,1,0,0,0
907,923,Tatli Kaçiklar,1996–2001,7.0,83.0,6.5,513749.99999999977,"The inseparable mates Rafet and Saffet are two clever and clumsy journalists who work at a newspaper's sports service. One is a newspaper photographer and the other a sports writer. Though they are inseparable, they have totally different personalities.",1.0,2.0,Meriç Acemi,Hamdi Alkan,Pinar Altug,13.0,1996,1,2,6.0,0,0,0,0,1,0,0,0,0,0,0,0,0,0,0,0,0,0,0,0,0,1,0,0,0,0,0
908,924,Oyunlar Holding,2021,7.0,12.0,8.0,137000.0,Talk-show with funny games.,1.0,2.0,Bilgehan Demir,Ismail Uzuner,Medeni Celik,18.0,2021,0,2,9.0,0,0,0,0,0,0,0,0,0,1,0,0,0,0,0,0,0,0,0,0,0,0,0,0,0,0,0
909,925,Alin Yazim,2014–2015,7.0,83.0,2.4,10000.0,"Asya, who lost her mother during childbirth and later lost her father when she was two days old, spent her life in orphanages. After her father's death, Asya remains the sole heir to a large fortune, but nobody knows this except her aunt Aysel.",4.0,2.0,Ipek Tuzcuoglu,Durukan Çelikkaya,Ebru Cündübeyoglu,91.0,2014,1,2,45.0,0,0,0,0,0,0,0,1,0,0,0,0,0,0,0,0,0,0,0,0,0,1,0,0,0,0,0
910,926,Gurbette Ask,2013–2014,7.0,83.0,4.5,35000.0,Unknown,2.0,2.0,Melek Baykal,Tomris Oguzalp,Kenan Pars,13.0,2013,1,2,6.0,0,0,0,0,1,0,0,0,0,0,0,0,0,0,0,0,0,0,0,0,0,0,0,0,0,1,0
911,927,Çemberin Disinda,2008,7.0,83.0,1.1,137000.0,Unknown,10.0,3.0,Nergis Öztürk,Cemal Toktas,Yeliz Kuvanci,6.0,2008,0,3,2.0,0,0,0,0,0,1,0,0,0,0,0,0,0,0,0,0,0,0,0,0,0,0,0,1,0,0,0
912,928,Yersiz Yurtsuz,2007,7.0,83.0,6.0,116000.0,"A beautiful girl from the countryside, she fell in love with the handsome gentleman "" Hussein"" who promised to marry her , after she got pregnant, her family knew about it and decided to kill her because of the strict traditions that not allowed the girls to have sexual intercourse intill marriage.",4.0,2.0,Gökçe Akyildiz,Funda Anapa,Suat Güzey,29.0,2007,0,2,14.0,0,0,0,0,0,0,0,1,0,0,0,0,0,0,0,0,0,0,0,0,1,1,0,0,0,0,0
913,929,Yalanci Bahar,2011,7.0,83.0,4.9,115000.0,A thief woman married a rich man. But the dirty shadow in her past has no intention of letting her go.,1.0,2.0,Mert Kiliç,Bora Karakul,Ertugrul Sakar,101.0,2011,0,2,45.0,0,0,0,0,0,0,0,1,0,0,0,0,0,0,0,0,0,0,0,0,0,0,0,0,0,0,0
914,930,Boynu Bükükler,2014,7.0,83.0,5.0,87000.0,"a group of orphaned high school children who started life 3-0 behind, bringing the situation to 3-3.",2.0,2.0,Meltem Akçöl,Murat Onuk,Burcu Almeman,100.0,2014,0,2,45.0,0,0,0,0,1,0,0,0,0,0,0,0,0,0,0,0,0,0,0,0,0,1,0,0,0,0,0
915,931,Iki Yabanci,2007,7.0,83.0,3.0,88000.0,"Cem graduated from the renowned Harvard University School of Medicine and completed his internship at major hospitals in the United States and returned home as a specialist neurosurgeon. Mustafa dreams of retiring Cem to all the hospitals. Cem's older brother, Omer, is not quite fit for his father's board chairmanship.",4.0,2.0,Furkan Palali,Su Kutlu,Cihan Ünal,3.0,2007,0,2,2.0,0,0,0,0,0,0,0,1,0,0,0,0,0,0,0,0,0,0,0,0,0,1,0,0,1,0,0
916,932,Çarkifelek,1975–2018,7.0,83.0,5.3,88000.0,Unknown,1.0,2.0,Yasemin Kay Allen,Ümit Kantarcilar,Altan Erkekli,2.0,1975,1,2,1.0,0,0,0,0,0,0,0,0,0,1,0,0,0,0,0,0,0,0,0,0,0,0,0,0,0,0,0
917,933,Ece,2008,7.0,83.0,2.3,57000.0,Ege wakes up as a woman one morning and finds himself in Ece's body. All his friends now look at him from a different perspective. Ege has no choice but to eliminate them.,2.0,2.0,Cemal Toktas,Hande Soral,Ceyda Ates,49.0,2008,0,2,24.0,0,0,0,0,1,0,0,0,0,0,0,0,0,0,0,0,0,0,0,0,0,0,0,0,1,0,0
918,934,Sakli Istanbul,2022,7.0,83.0,6.2,65000.0,Embark on a stunning journey through the landscape and history of Istanbul in this documentary series.,1.0,2.0,Okan Bayülgen,Erol Günaydin,Hakki Devrim,22.0,2022,0,2,11.0,0,0,0,0,0,0,1,0,0,0,0,0,0,0,0,0,0,0,0,0,0,0,1,0,0,0,0
919,935,Eski Hikaye,2013–2014,7.0,83.0,7.7,278000.0,Mete will take revenge for the death of his father and fight alone against a big mafia.,4.0,2.0,Halil Ergün,Emrah,Hülya Darcan,30.0,2013,1,2,15.0,0,0,0,0,0,0,0,1,0,0,0,0,0,0,0,0,0,0,0,0,0,1,0,0,0,0,0
920,936,Babalar ve Evlatlar,2012,7.0,83.0,3.1,85000.0,"Aslan, the old bully with six children, swore not to use a gun. Aslan's son Burhan kills Eyyo who raped one of the women in the neighborhood and he goes to jail. He makes a deal with the other family to keep Burhan away from his blood case. But young people in the family are not make a deal with him. And there is a relentless hostility between the two families.",4.0,2.0,Hülya Avsar,Cihan Ünal,Zerrin Sümer,52.0,2012,0,2,26.0,0,0,0,0,0,0,0,1,0,0,0,0,0,0,0,0,0,0,0,0,0,1,0,0,0,0,0
921,937,Crossover Talks,2020,7.0,83.0,9.3,137000.0,"Geeky influencers producing different kinds of content gather around a table to talk, released weekly.",2.0,2.0,Ali Sürmeli,Turgay Tanülkü,Ümit Acar,101.0,2020,0,2,45.0,0,0,0,0,1,0,0,0,0,0,0,0,0,0,0,0,0,0,0,0,0,0,0,0,0,1,1
922,938,Kolej Rüyasi,2021,7.0,83.0,2.3,44000.0,Unknown,2.0,2.0,Ipek Tuzcuoglu,Orhan Kilic,Gonca Sariyildiz,23.0,2021,0,2,12.0,0,0,0,0,1,0,0,0,0,0,0,0,0,0,0,0,0,0,0,0,0,0,0,0,0,0,0
923,939,Mert ile Gert,2008,7.0,83.0,3.1,211000.0,Funny stories about two brothers mert and gert.,2.0,2.0,Banu Alkan,Bülent Ersoy,Safiye Soyman,5.0,2008,0,2,2.0,0,0,0,0,1,0,0,0,0,0,0,0,0,0,0,0,0,0,0,0,0,0,0,0,0,0,0
924,940,Hekimoglu,2003,7.0,83.0,5.9,14000.0,"Hekimoglu Omer, who has been struggling to rescue the Numan Valley from evil since the beginning, eventually pressed the Kahya thoroughly to the corner. But of course Kahya and Dündar Bey will not retreat without making a final move. They are willing to take Hekimoglu with them when they leave. In the meantime, Aslan Bey leaves the house voluntarily.",1.0,2.0,,,,11.0,2003,0,2,6.0,1,0,0,0,0,0,0,0,0,0,0,0,0,0,0,0,0,0,0,0,0,0,0,0,0,0,0
925,941,Iki Arada,2002,7.0,83.0,3.0,59000.0,Unknown,2.0,2.0,Nilsu Berfin Aktas,Genco Ozak,Savas Özdemir,6.0,2002,0,2,3.0,0,0,0,0,1,0,0,0,0,0,0,0,0,0,0,0,0,0,0,0,0,0,0,0,0,0,0
926,942,Ölümsüz Kahramanlar,2006–2010,7.0,83.0,5.4,81000.0,Unknown,4.0,2.0,Nevra Serezli,Atilla Olgaç,Sidika Senkan,60.0,2006,1,2,30.0,0,0,0,0,0,0,0,1,0,0,0,0,0,0,0,0,0,0,0,0,0,0,0,0,0,1,0
927,943,Gün Aksam Oldu,2011,7.0,83.0,5.4,81000.0,Unknown,4.0,2.0,Gökçe Akyildiz,Alpay Kemal Atalan,Ceren Benderlioglu,13.0,2011,0,2,6.0,0,0,0,0,0,0,0,1,0,0,0,0,0,0,0,0,0,0,0,0,0,0,0,0,0,0,0
928,945,Dünya Hali,2021,7.0,83.0,6.5,112000.0,"What would you do if the last wish of your beloved family member before he dies is ""marry a girl who gets up early, appreciates the old one and looks like a honey badger""? The interesting journey of this unique testament finds answers in the World State series.",1.0,2.0,Utku Ergin,Ali Riza Tanyeli,Hidayet Tili,13.0,2021,0,2,6.0,0,0,0,0,1,0,0,0,0,0,0,0,0,0,0,0,0,0,0,0,1,1,0,0,0,0,0
