,Unnamed: 0,Name,Years,Age,Duration,Rating,VoteCount,Summary,Review_Count,Seasons,Star1,Star2,Star3,EpisodeCount,baslangic,isFinal,Sınıf,EpsPerSeason,Action,Adventure,Animation,Biography,Comedy,Crime,Documentary,Drama,Family,Game-Show,History,Music,News,Reality-TV,Romance,Sci-Fi,Short,Sport,Talk-Show,others,HasLove,HasFamily,HasIstanbul,Basrol_Class1,Basrol_Class2,Basrol_Class3,Basrol_Class4
424,428,Kinali Kar,2002–2004,7.0,83.0,4.1,333000.0,"A young teacher assigned to a schoolless village fights with the village landlords for the children's right to education. At the same time, he falls into an impossible love.",1.0,2.0,Yesim Büber,Saruhan Hünel,Umut Tabak,49.0,2002,1,2,24.0,0,0,0,0,0,0,0,1,0,0,0,0,0,0,0,0,0,0,0,0,1,1,0,0,0,0,0
425,429,Baba Candir,2015–2017,7.0,83.0,7.5,513749.99999999977,"The life of a father and his three children will change when they meet a naive girl, a narcissistic businessman and a pop-star.",10.0,2.0,Necati Sasmaz,Gürkan Uygun,Sönmez Atasoy,2.0,2015,1,2,1.0,0,0,0,0,1,0,0,0,0,0,0,0,0,0,0,0,0,0,0,0,0,1,0,0,0,0,0
426,430,Tarihin Efsaneleri,2021–2022,7.0,83.0,7.6,35000.0,"Epic stories of historical heroes who became legendary with their struggles are on TRT Documentary with ""Legends of History"".",1.0,2.0,Serkan Keskin,Sebnem Hassanisoughi,Mustafa Kirantepe,4.0,2021,1,2,2.0,0,0,0,0,0,0,1,0,0,0,0,0,0,0,0,0,0,0,0,0,0,0,0,1,0,0,0
427,431,Vahsi Seyler,2021– ,7.0,15.0,4.8,432000.0,"They become a part to a crime and fall for each other again. What are they going to do now? ""Wild Things"" questions the anatomy of marriage getting lost in the action and comedy.",1.0,2.0,Baris Arduç,Cansu Tosun,Begüm Akkaya,37.0,2021,0,2,18.0,0,0,0,0,1,0,0,0,0,0,0,0,0,0,0,0,0,0,0,0,0,0,0,0,0,0,0
428,432,Çarli Is Basinda,2000,7.0,83.0,5.9,174000.0,"A family owned monkey (Çarli), at that time its ability and success succeeded in helping the house do many things. Çarli soon became an adopted child of the individual at home.",2.0,2.0,Ilker Kaleli,Neslihan Atagül,Berrak Tüzünataç,8.0,2000,0,2,4.0,0,0,0,0,1,0,0,0,0,0,0,0,0,0,0,0,0,0,0,0,0,1,0,0,0,0,0
429,433,Kollama,2008–2011,7.0,83.0,5.7,110000.0,"a story that traces a book in which deep state secrets are kept hidden, conspiracy theories, assassinations, provocations, and unsolved murders.",10.5,4.0,Özgü Namal,Caner Cindoruk,Mehmet Çevik,70.0,2008,1,3,18.0,1,0,0,0,0,0,0,0,0,0,0,0,0,0,0,0,0,0,0,0,0,0,0,1,0,0,0
430,434,Bir Yeralti Sitcom'u,2021,7.0,83.0,5.2,2400.0,"The dreams of Hasan Can Kaya, who lives with his low-income family in Güngören district of Istanbul and wants to become a comedian one day, are mixed with the realities of life.",6.0,2.0,Nazan Kesal,Buse Meral,Cem Yigit Uzümoglu,1.0,2021,0,2,0.0,0,0,0,0,1,0,0,0,0,0,0,0,0,0,0,0,0,0,0,0,0,1,1,0,0,0,0
431,435,Hiç,2021,7.0,30.0,3.2,168000.0,"The ""trade"" that a group of young people trying to hold on to university life who came together despite class divisions started to help their friends, turns into a much larger organization.",1.0,3.0,Ismail Demirci,Aslihan Güner,Toygan Avanoglu,64.0,2021,0,3,21.0,0,0,0,0,0,1,0,0,0,0,0,0,0,0,0,0,0,0,0,0,0,0,0,0,0,0,0
432,436,Evli ve Öfkeli,2015–2016,7.0,83.0,6.2,239000.0,"Four wives have been betrayed by their husbands , support each other and trying to deal with that in comedic and romantic ways.",1.0,2.0,Nur Sürer,Bülent Inal,Sinan Tuzcu,40.0,2015,1,2,20.0,0,0,0,0,1,0,0,0,0,0,0,0,0,0,0,0,0,0,0,0,0,1,0,1,0,0,0
433,437,Cam Tavanlar,2021,7.0,83.0,5.8,513749.99999999977,"A story full of competition, revenge, love and determination, telling about women's inequality of opportunity in social life.",22.5,2.0,Ugur Günes,Gulsim Ali,Ridvan Aybars Duzey,19.0,2021,0,2,10.0,0,0,0,0,1,0,0,0,0,0,0,0,0,0,0,0,0,0,0,0,1,0,0,0,0,0,0
434,438,Ex Askim,2021,7.0,5.0,5.9,149000.0,Ex-lovers meet in a cafe after their relationship ended for some reason or ended in disappointment. Cafe is the scene of completely different events in every episode.,2.0,2.0,Tolgahan Sayisman,Selen Soyder,Kenan Bal,101.0,2021,0,2,45.0,0,0,0,0,1,0,0,0,0,0,0,0,0,0,0,0,0,0,0,0,1,1,0,0,1,0,0
435,439,Kalbimin Sultani,2018,7.0,83.0,6.6,415000.0,Mahmud brings Anna to his palace to teach his children French. The Russian ambassador also sends Anna there with the pressure to 'spy on the sultan's country'.,6.0,2.0,Melike Emiroglu,Tonguç Nacar,,21.0,2018,0,2,10.0,0,0,0,0,1,0,0,0,0,0,0,0,0,0,0,0,0,0,0,0,0,1,0,0,0,0,0
436,440,Barbaros Hayreddin: Sultan Fermani,2022–2023,7.0,83.0,5.8,84000.0,"The story of Hayreddin Barbarossa, an Ottoman corsair and later admiral of the Ottoman Navy.",10.5,2.0,Tolgahan Sayisman,Selen Soyder,Kenan Bal,101.0,2022,1,2,45.0,1,0,0,0,0,0,0,0,0,0,0,0,0,0,0,0,0,0,0,0,0,0,0,0,1,0,0
437,441,Kayip Sehir,2012–2013,7.0,83.0,7.4,424000.0,"What is happening in Istanbul's back streets? Which lives are flowing, in the shadow of poverty? Women, gypsies, transvestites, street children each are victims of another discrimination. A typical Black Sea family connected to each other will meet with people who are trying to cling to the loneliness of life in this neighborhood.",2.0,2.0,Melike Emiroglu,Tonguç Nacar,,21.0,2012,1,2,10.0,0,0,0,0,0,0,0,1,0,0,0,0,0,0,0,0,0,0,0,0,0,1,1,0,0,0,0
438,442,Güzel Köylü,2014–2015,7.0,120.0,5.8,404000.0,A beautiful girl from Istanbul moves to a small village and that changes her life.,1.0,2.0,Melek Baykal,Ayten Erman,Alisan,101.0,2014,1,2,45.0,0,0,0,0,1,0,0,0,0,0,0,0,0,0,0,0,0,0,0,0,0,0,1,0,0,1,0
439,443,Gönül Isleri,2014–2015,7.0,120.0,6.1,486000.0,The story of three sisters who live with their father after their mother abandoned them and who experience many changes in their lives while in search for marriage partners and true love.,1.0,2.0,Yurdaer Okur,Saygin Soysal,Ipek Karapinar,8.0,2014,1,2,4.0,0,0,0,0,0,0,0,1,0,0,0,0,0,0,0,0,0,0,0,0,1,1,0,1,0,0,0
440,444,Bonkis,2021–2022,7.0,83.0,6.7,513749.99999999977,"Deniz is an idiosyncratic, stubborn and passionate woman. She followed her dreams and opened a cafe called Bonkis instead of doing her architectural profession, but her rosy dreams did not match the reality. Struggling to survive economically, Deniz struggles with the complex life of her family on the one hand.",2.0,2.0,Özge Yagiz,Derya Kurtulus,Atilla Pekdemir,101.0,2021,1,2,45.0,0,0,0,0,1,0,0,0,0,0,0,0,0,0,0,0,0,0,0,0,0,1,0,0,0,0,0
441,445,Ben de Özledim,2013–2014,7.0,83.0,8.0,7800.0,"Leyla and Mecnun series has been canceled, as the teams try to hold on to life.",1.0,2.0,Deniz Baysal,Algi Eke,Selen Domaç,3.0,2013,1,2,2.0,0,0,0,0,1,0,0,0,0,0,0,0,0,0,0,0,0,0,0,0,0,0,0,0,0,0,0
442,447,Sehrin Melekleri,2015,7.0,83.0,4.0,14000.0,The opinion on the failure of Istanbul security among the public in Istanbul; the police forces the members of the crime to set up a young team to push. Cemal is assigned to the task for this task. Cemal gathers talented young policemen to his team.,10.5,2.0,Seçkin Özdemir,Özge Özpirinçci,Baris Falay,37.0,2015,0,2,18.0,1,0,0,0,0,0,0,0,0,0,0,0,0,0,0,0,0,0,0,0,0,0,1,1,0,0,0
443,448,Racon,2015,7.0,83.0,5.6,183000.0,"Deciding to ensure his own justice after the death of his judge father, Kenan declares war on his enemies and becomes a mafia boss who disregards the laws.",1.0,2.0,Tolgahan Sayisman,Esra Bilgiç,Hazal Subasi,6.0,2015,0,2,3.0,0,0,0,0,0,0,0,1,0,0,0,0,0,0,0,0,0,0,0,0,0,1,0,0,0,0,0
444,449,Benim Tatli Yalanim,2019,7.0,120.0,6.2,508000.0,"Abandoned by his wife, Nejat is lying to his daughter not to be upset. But as Kayra grows, these lies become unbearable. Nejat, who is trapped in the corner, meets Suna unexpectedly when he thinks that it is the end of everything. With Suna's entry into their lives, both Nejat and Kayra's world is completely changed.",7.0,2.0,Asli Melisa Uzun,Idris Nebi Taskan,Su Kutlu,10.0,2019,0,2,5.0,0,0,0,0,1,0,0,0,0,0,0,0,0,0,0,0,0,0,0,0,0,1,0,0,1,0,0
445,450,Serhat,2023– ,7.0,50.0,6.5,210000.0,"Special Forces Police Commissioner in voluntary exile is called back home to join the fight against the evil taking over the city. Not only is the challenge more difficult than expected, but he is also faced with the demons of his past.",10.5,2.0,Ipek Filiz Yazici,Atakan Hosgören,Gizem Arikan,5.0,2023,0,2,2.0,1,0,0,0,0,0,0,0,0,0,0,0,0,0,0,0,0,0,0,0,0,0,0,0,0,0,0
446,451,Menekse ile Halil,2007–2008,7.0,83.0,6.4,1500.0,A story about a girl called Menekse who is forced to marry her brother's friend until she decides to escape from Germany to Turkey with her lover Halil.,5.0,3.0,Yunus Emre Yildirimer,Gizem Günes,Nihan Büyükagaç,11.0,2007,1,3,4.0,0,0,0,0,0,1,0,0,0,0,0,0,0,0,0,0,0,0,0,0,1,0,0,0,0,0,0
447,452,Yardimci Oyuncu,2023– ,7.0,83.0,8.4,202000.0,"Murat, who is suddenly homeless and penniless, while thinking about what to do, meets the TV series sets in the ""extra"" coffee house he entered by chance.",2.0,2.0,Erdal Besikçioglu,Elit Iscan,Ahmet Rifat Sungar,7.0,2023,0,2,4.0,0,0,0,0,1,0,0,0,0,0,0,0,0,0,0,0,0,0,0,0,0,0,0,0,0,0,0
448,453,Tutunamayanlar,2020,7.0,83.0,7.4,1300.0,"Tarik, who has never worked in his life, falls in love with Irem in a job interview. Having no place to go, Irem comes to the neighborhood where Tarik lives and starts to work at the book cafe in the neighborhood. Irem's dream is to be successful, to establish her own business and to return to her old days one day.",1.0,2.0,Bugra Gülsoy,Beren Gokyildiz,Leyla Lydia Tugutlu,35.0,2020,0,2,18.0,0,0,0,0,1,0,0,0,0,0,0,0,0,0,0,0,0,0,0,0,1,0,0,0,0,0,0
449,454,Sakarya-Firat,2009–2013,7.0,83.0,6.8,513749.99999999977,"""Sakarya Firat"" is a TV show that depicts the lives of the Turkish Gendarmerie Commandos and Soldiers, whom are assigned to the Southeastern frontier of Turkey. Here the soldiers struggle with their duties as soldiers and who they are in their personal lives, while being under constant threat of the Kurdish terrorist organization PKK (Kurdish Workers Party) attack.",10.5,3.0,Taha Ulukaya,Neslihan Ulusoy,Andac Semerci,24.0,2009,1,3,8.0,1,0,0,0,0,0,0,0,0,0,0,0,0,0,0,0,0,0,0,0,0,1,0,0,0,0,0
450,455,Tetikçinin Oglu,2023,7.0,83.0,5.7,149000.0,"Iskender's son dies as a result of an accident. The accused is Metin, Korkmaz's son, whom he lost 22 years ago. Now the two friends are against each other for their sons.",10.5,2.0,Ahmet Kural,Pelin Karahan,Serkan Çayoglu,24.0,2023,0,2,12.0,1,0,0,0,0,0,0,0,0,0,0,0,0,0,0,0,0,0,0,0,0,1,0,1,1,0,0
451,456,Ben Gri,2022,7.0,83.0,6.3,1000.0,"Fuat is a successful and respected lawyer. One day a bad incident happened to his daughter. The series will convey to the audience how Fuat, while trying to avenge his daughter's incident, confronts the darkness within himself and tries to achieve his own justice, along with the mysterious messages that come to his phone.",4.0,3.0,Erkan Petekkaya,Sebnem Bozoklu,Ilayda Çevik,4.0,2022,0,3,1.0,0,0,0,0,0,1,0,0,0,0,0,0,0,0,0,0,0,0,0,0,0,1,0,0,0,0,0
452,457,Dikkat Bebek Var,2000–2002,7.0,83.0,5.6,54000.0,"The adventures of a talking baby named ""Baris"".",2.0,2.0,Aysun Güven,Yavuz Pekdiker,Birhan Tut,101.0,2000,1,2,45.0,0,0,0,0,1,0,0,0,0,0,0,0,0,0,0,0,0,0,0,0,0,0,0,0,0,0,0
453,458,Kalbimdeki Deniz,2016–2018,7.0,83.0,4.2,208000.0,"Deniz has everything a woman can ask for. But when her husband disappeared no trace, this happy life changes. Deniz, who is in a desperate state with her two children and her father, meets Mirat who will be a lover and be a life-saver.",5.0,2.0,Erkan Petekkaya,Hatice Sendil,Hülya Darcan,62.0,2016,1,2,31.0,0,0,0,0,0,0,0,1,0,0,0,0,0,0,0,0,0,0,0,0,1,1,0,0,0,0,0
454,459,Ferhat ile Sirin,2019,7.0,83.0,5.5,373000.0,"Ferhat, Sirin and Banu - They are unaware that they are dragged into a vortex where they will experience the miracle of love and the disaster. Theirs is a story of impossible love. Banu will be the biggest obstacle between Ferhat and Sirin.",3.0,2.0,Nusret Senay,Ceren Yalazoglu,Ilkay Kayku Atalay,13.0,2019,0,2,6.0,0,0,0,0,0,0,0,1,0,0,0,0,0,0,0,0,0,0,0,0,1,0,0,0,0,0,0
455,460,Lise Defteri,2003–2004,7.0,83.0,5.8,513749.99999999977,"The troubles of the young people during their adolescence, the secrets they hide from their parents and teachers, the TV series that describes the happiness and sadness in high school.",4.0,2.0,Tuba Büyüküstün,Cansel Elcin,Onur Saylak,56.0,2003,1,2,28.0,0,0,0,0,0,0,0,1,0,0,0,0,0,0,0,0,0,0,0,0,0,0,0,1,0,0,0
456,461,Yedi Güzel Adam,2014–2015,7.0,105.0,7.6,1300.0,"Important writers in Turkish literature Cahit Zarifoglu, Nuri Pakdil, Mehmet Akif Inan, Erdem Bayazit, Rasim Ozdenoren, Ali Kutlay and Alaeddin Ozdenoren's tells of life.",1.0,2.0,Can Yaman,Cengiz Bozkurt,Altan Erkekli,40.0,2014,1,2,20.0,0,0,0,1,0,0,0,0,0,0,0,0,0,0,0,0,0,0,0,1,0,0,0,0,0,0,0
457,462,Seni Kimler Aldi,2017,7.0,83.0,4.7,66000.0,"Baris and Zehra, who want to protect their love, are in the shadow of Ceren's revenge.",2.0,2.0,Erdal Özyagcilar,Onur Buldu,Melis Babadag,22.0,2017,0,2,11.0,0,0,0,0,0,0,0,1,0,0,0,0,0,0,0,0,0,0,0,0,1,0,0,1,0,0,0
458,463,Yeni Gelin,2017–2018,7.0,120.0,4.8,428000.0,"Bella, a Spanish Girl falls in love with a Turkish man, Hazar. They decide to marry against the wish of their families. Bella is a modern girl and Hazar's family is very traditional, so their cultures clash.",2.0,3.0,Engin Altan Düzyatan,Elçin Sangu,Elcin Afacan,30.0,2017,1,3,10.0,0,1,0,0,0,0,0,0,0,0,0,0,0,0,0,0,0,0,0,0,1,1,0,1,1,0,0
459,464,Yüz Yillik Mucize,2023,7.0,83.0,6.3,411000.0,"It tells the story of Ali Tahir, who has lived 100 years without aging a single day. However, after everything he has been through, he decides to end his life. But everything changes when he meets Harika.",11.0,2.0,Furkan Andic,Yigit Kirazci,Nilay Deniz,16.0,2023,0,2,8.0,0,0,0,0,0,0,0,1,0,0,0,0,0,0,0,0,0,0,0,0,0,0,0,0,1,0,0
460,465,Familya,2016,7.0,83.0,5.7,171000.0,It is the story of a group of Beyoglu families and their father Yasar Beyoglu who tried to recapture the family together with the news of years later.,1.0,2.0,Asli Tandogan,Burak Hakki,Özge Özder,75.0,2016,0,2,38.0,0,0,0,0,1,0,0,0,0,0,0,0,0,0,0,0,0,0,0,0,0,1,0,1,0,0,0
461,466,Son,2012–2013,7.0,83.0,7.4,1100.0,"After a plane crash, a devoted wife learns that her life and marriage is all a lie.",10.0,3.0,Irem Helvacioglu,Engin Öztürk,Selin Yeninci,11.0,2012,1,3,4.0,0,1,0,0,0,0,0,0,0,0,0,0,0,0,0,0,0,0,0,0,0,1,0,0,1,0,0
462,467,Yesil Deniz Milenyum,2023– ,7.0,83.0,8.7,245000.0,"A few years after Ismail's departure, the footsteps of the age of technology began to be heard in the warm and friendly town of Yesilova, and there were great changes in the lives of the family.",2.0,2.0,Soray Uzun,Özlem Türkad,Hakan Bulut,101.0,2023,0,2,45.0,0,0,0,0,1,0,0,0,0,0,0,0,0,0,0,0,0,0,0,0,0,1,0,0,0,0,0
463,468,Gokturkler Asya'nin Efendileri,2023– ,7.0,150.0,5.9,14000.0,"It tells the collapse and resurrection of the greatest empire Asia has ever seen, the epic of the Gokturk Khanate. It is about 620 and 650 Chinese captivity and then the Kurshad revolution and 40 soldiers.",10.5,2.0,Tarik Akan,Ebru Cündübeyoglu,Sevil Üstekin,24.0,2023,0,2,12.0,1,0,0,0,0,0,0,0,0,0,0,0,0,0,0,0,0,0,0,0,0,0,0,0,0,0,0
464,469,Kanit,2010–2013,7.0,83.0,7.6,513749.99999999977,"In each episode, detectives Orhan and Selim attempt to solve puzzling cases with the help and guidance of forensics. Professor Sevil Atasoy, a renowned forensic scientist, also joins us sometimes to share relevant anecdotes.",2.0,3.0,Özcan Deniz,Irem Helvacioglu,Mustafa Ugurlu,13.0,2010,1,3,4.0,0,0,0,0,0,1,0,0,0,0,0,0,0,0,0,0,0,0,0,0,0,0,0,1,0,0,0
465,470,Fedakar,2023,7.0,83.0,7.2,92000.0,"The thrilling story of Tarik, who wishes to take revenge on his brother's murderer, and Elif, who cannot accept that her only hope in life is the murderer.",6.0,2.0,Özlem Yilmaz,Engin Hepileri,Ushan Çakir,37.0,2023,0,2,18.0,0,0,0,0,0,0,0,1,0,0,0,0,0,0,0,0,0,0,0,0,0,0,0,1,0,0,0
466,471,Deneme Çekimi,2023– ,7.0,83.0,5.2,76000.0,"Kübra, who is trying to hold on to the cinema and television world, sometimes meets with fringe directors who target festivals in her casting auditions; Sometimes it intersects with opportunistic producers aiming for totality. This diversity of test shoots will challenge both his acting and social identity.",1.0,2.0,Ugur Yücel,Kenan Imirzalioglu,Settar Tanriögen,37.0,2023,0,2,18.0,0,0,0,0,1,0,0,0,0,0,0,0,0,0,0,0,0,0,0,0,0,0,0,0,0,0,0
467,472,Olacak O Kadar,1986–2010,7.0,120.0,8.5,3100.0,A comedy show about people's daily routines and life.,2.0,4.5,,,,1.0,1986,1,5,0.0,0,0,0,0,1,0,0,0,0,0,0,0,0,0,0,0,0,0,0,0,0,0,0,0,0,0,0
468,473,Evlat Kokusu,2017,7.0,83.0,4.8,82000.0,"Zeyno, a hospital nurse in Amsterdam, finds out she is pregnant by her first love. She daydreams of her wonderful future with the love of her life and their baby, unaware of the surprises that life is about to throw her way. A continent away, the powerful Akbas family has a young daughter need of a bone-marrow transplant and will do anything to get it.",4.0,2.0,Özge Özpirinçci,Bugra Gülsoy,Tamer Levent,59.0,2017,0,2,30.0,0,0,0,0,0,0,0,1,0,0,0,0,0,0,0,0,0,0,0,0,1,1,0,1,0,1,0
469,474,Mavera: Hace Ahmed Yesevi,2021,7.0,83.0,6.7,409000.0,"The religious fight of Hace Ahmed Yesevi, a Turkic poet and Sufi, who was sent to Baghdad by Yusuf Hemedani for the truth.",4.0,2.0,Türkan Soray,Cihan Ünal,Baris Aksavas,13.0,2021,0,2,6.0,0,0,0,0,0,0,0,0,0,0,1,0,0,0,0,0,0,0,0,1,0,0,0,0,0,0,0
470,475,Yesil Deniz,2014–2016,7.0,110.0,8.0,513749.99999999977,"A small Turkish Aegean town in the 90's and the warm, friendly, sincere people of this town.",1.0,2.0,Özge Özpirinçci,Bugra Gülsoy,Tamer Levent,59.0,2014,1,2,30.0,0,0,0,0,1,0,0,0,0,0,0,0,0,0,0,0,0,0,0,0,0,0,0,1,0,1,0
471,476,Rüya,2017,7.0,83.0,4.7,244000.0,"Cemal San is sitting in the director's chair while the young girl who is experiencing financial difficulties and the rich man love story is told the screenplay of the series is the Kaktus Yazi Grubu. Elif, who wants to be an artist, meets with the textile custodian, Bulut, and falls in love.",7.0,2.0,Türkan Soray,Cihan Ünal,Baris Aksavas,13.0,2017,0,2,6.0,0,0,0,0,0,0,0,0,1,0,0,0,0,0,0,0,0,0,0,1,1,0,0,0,0,0,0
472,477,Dönence,2023,7.0,83.0,5.3,216000.0,"Gece plans to go to university and dreams of making music with her boyfriend Emir for the whole summer. However, she moves with her family to Foça and meets Özgür, an instructor at the yacht club.",1.0,2.0,Yigit Özsener,Riza Kocaoglu,Esra Bezen Bilgin,8.0,2023,0,2,4.0,0,0,0,0,0,0,0,1,0,0,0,0,0,0,0,0,0,0,0,0,0,1,0,0,0,0,0
473,478,Çember,2017–2022,7.0,90.0,7.3,513749.99999999977,The story of the murder investigation bureau solving crime cases.,1.0,3.0,Hamdi Alkan,Yilsu Sarper,Yilmaz Tüzün,24.0,2017,1,3,8.0,1,0,0,0,0,0,0,0,0,0,0,0,0,0,0,0,0,0,0,0,0,0,0,0,0,0,0
474,479,Exatlon Türkiye,2020,7.0,46.0,4.0,513749.99999999977,Orkun Isitmak hosts an epic sports challenge pitting Turkey's influencers against each other. Who will party - and who will be punished?,8.0,2.0,Onur Ugras,,,13.0,2020,0,2,6.0,0,0,0,0,0,0,0,0,0,1,0,0,0,0,0,0,0,0,0,0,0,0,0,0,0,0,0
475,480,Kusursuz Kiraci,2022,7.0,83.0,6.6,418000.0,"Mona is a young woman who grew up in an orphanage. He works for the Internet newspaper and has been reporting on the cases of house arson in different parts of Istanbul recently. Again, one day when he goes to the news of the fire, they come across the photo reporter Yakup, who came to do the same news.",6.0,2.0,Hazal Kaya,Alpay Kemal Atalan,Selen Seyven,51.0,2022,0,2,26.0,0,0,0,0,1,0,0,0,0,0,0,0,0,0,0,0,0,0,0,0,0,1,1,0,1,0,0
476,481,Sana Söz,2021,7.0,83.0,5.2,80000.0,"Elif Karaca is the creator of the program ""Don't Be Silent with Elif Karaca"", which Turkey follows with interest. Elif has dedicated her life to fighting the injustices and evils she has witnessed since her childhood. Murder Bureau commissioner Ömer, just like Elif, has struggled with bad guys, criminals and criminals throughout his life.",1.0,2.0,Selda Özbek,Hakan Altiner,Sinan Çaliskanoglu,101.0,2021,0,2,45.0,0,0,0,0,0,0,0,1,0,0,0,0,0,0,0,0,0,0,0,0,0,0,0,0,0,0,0
477,482,Buyur Burdan Bak,2015–2018,7.0,83.0,6.0,89000.0,Unknown,2.0,2.0,Hande Ataizi,Berat Yenilmez,Ayse Tunaboylu,101.0,2015,1,2,45.0,0,0,0,0,1,0,0,0,0,0,0,0,0,0,0,0,0,0,0,0,0,0,0,1,0,0,0
478,483,Survivor 2018,2018,7.0,83.0,4.5,162000.0,"The most popular survival tv-reality worldwide, coming to the screens with 2018 staff in Turkey.",2.5,3.0,Kadir Dogulu,Serra Aritürk,Alper Saldiran,13.0,2018,0,3,4.0,0,1,0,0,0,0,0,0,0,0,0,0,0,0,0,0,0,0,0,0,0,0,0,0,0,0,0
479,484,Ötesiz insanlar,2013–2015,7.0,83.0,6.7,76000.0,"In 1996, a village girl in turkey, Elif Gürel dreams of becoming a doctor. His abusive father is marrying her off to a rich man. She meets an army officer , Deniz , who encourages her to realize her dream. Helped by her mother, she takes a big step, but is soon caught in trouble. Her mother turns to an old secret to help her beloved daughter. A story of a strong girl,... Read all",4.0,2.0,Ulas Tuna Astepe,Hazar Ergüçlü,Tansel Öngel,8.0,2013,1,2,4.0,0,0,0,0,0,0,0,1,0,0,0,0,0,0,0,0,0,0,0,0,1,1,0,1,0,0,0
480,485,Beni Böyle Sev,2013–2015,7.0,83.0,7.2,513749.99999999977,"The story of Aysem and Ömer, who think that they will be able to take responsibility for their dreams, their love and each other, and to have difficulties together, instead of temporary relations that they will live for their daily fervor in their youth.",7.0,3.0,Kaan Yildirim,Özge Gürel,Kerem Alisik,8.0,2013,1,3,3.0,0,0,0,0,1,0,0,0,0,0,0,0,0,0,0,0,0,0,0,0,1,0,0,0,1,0,0
481,486,Süper Baba,1993–1997,7.0,45.0,8.8,4500.0,"A family father struggles in maintaining lifelong relationships with three of his growing children ,after he divorced with his wife. In the unique Çengelköy district Fikret struggles with life, beside love, pain, hope.",4.0,2.0,Engin Akyürek,Fahriye Evcen Özçivit,Gülcan Arslan,13.0,1993,1,2,6.0,0,0,0,0,1,0,0,0,0,0,0,0,0,0,0,0,0,0,0,0,1,1,0,1,0,0,0
482,487,Derin Sular,2011,7.0,83.0,3.4,1900.0,Young teens just finished the high school and they begin to college. And they realized real life is not easy. Teen drama about their struggles with life and become an adult.,4.0,2.0,Emrah,Özlem Conker,Mustafa Avkiran,90.0,2011,0,2,45.0,0,0,0,0,0,0,0,1,0,0,0,0,0,0,0,0,0,0,0,0,0,0,0,0,0,0,0
483,488,Kaderimin Yazildigi Gün,2014–2015,7.0,83.0,5.0,513749.99999999977,"Defne and Kahraman Yorukhan are rich but have no children. Their family rebukes make Deffe look for an alternative way to give her husband a heir. She decides to hire a surrogate mother to take the baby for her. Her choice falls on Elf, a young woman from the birthplace of Kahraman Antakya.",4.0,2.0,Settar Tanriögen,Uraz Kaygilaroglu,Berna Koraltürk,66.0,2014,1,2,33.0,0,0,0,0,0,0,0,1,0,0,0,0,0,0,0,0,0,0,0,0,0,1,0,0,0,0,0
484,489,Yaz Sarkisi,2023,7.0,83.0,5.4,188000.0,"The series follows Yaz, who moves to Istanbul to pursue her late father's dream. Her arrival will put the friendship of two close friends, Murat and Kemal, to the test.",3.0,2.0,Serdar Deniz,Dogan Baris Yasar,Murat Karak,16.0,2023,0,2,8.0,0,0,0,0,1,0,0,0,0,0,0,0,0,0,0,0,0,0,0,0,0,1,1,0,0,0,0
485,490,Ilginç Bazi Olaylar,2021– ,7.0,40.0,6.6,1000.0,"What kind of life would Ibrahim Büyükak have if he did not pursue his dreams and continued to stay with his family in Bursa? Abandoned by his fiancee and living with his family, 35-year-old Ibrahim will go his own way?",3.0,2.0,Nurgül Yesilçay,Selim Bayraktar,Hazal Türesan,8.0,2021,0,2,4.0,0,0,0,0,1,0,0,0,0,0,0,0,0,0,0,0,0,0,0,0,0,1,0,0,1,0,0
486,491,Kizlar ve Anneleri,2013– ,7.0,83.0,4.7,11000.0,Unknown,1.0,2.0,Ilker Aksum,Berrin Arisoy,Yalçin Avsar,13.0,2013,0,2,6.0,0,0,0,0,0,0,0,0,0,1,0,0,0,0,0,0,0,0,0,0,0,0,0,0,0,0,0
487,492,Askin Yolculugu: Haci Bayram Veli,2022,7.0,83.0,7.7,94000.0,The show is about a 14th century Turkish Sufi living in Anatolia and tells his spiritual journey over the course of his lifetime.,16.0,2.0,Mehmet Özgür,Gökçe Akyildiz,Orhan Biyikli,101.0,2022,0,2,45.0,0,0,0,1,0,0,0,0,0,0,0,0,0,0,0,0,0,0,0,1,0,0,0,1,0,0,0
488,493,Yeditepe Istanbul,2001–2002,7.0,83.0,8.6,1600.0,"When Olcay's husband commits suicide and leaves a huge debt behind, Olcay and her teenage daughter, Duru, are forced to move to a slum in Istanbul. They find themselves financially dependent on Olcay's only remaining friend, so Olcay starts to look for a job.",2.0,2.0,Hasan Can Kaya,Ezgi Gör,Günay Karacaoglu,10.0,2001,1,2,5.0,0,0,0,0,1,0,0,0,0,0,0,0,0,0,0,0,0,0,0,0,0,1,1,0,0,0,0
489,494,Ekip 1: Nizama Adanmis Ruhlar,2012–2015,7.0,83.0,3.8,142000.0,"On the one hand they try to do their job in the best way, on the other hand they have to deal with the problems in their private lives. ""Orderly Devotional Spirits: Team 1"", which carries the adventures of a seven-man action team on the screen, mirrors the invisible face of the policing profession.",1.0,4.0,Caner Topcu,Taylan Meydan,Ecem Gümüssu,8.0,2012,1,3,2.0,1,0,0,0,0,0,0,0,0,0,0,0,0,0,0,0,0,0,0,0,0,0,0,0,0,0,0
490,495,Galip Dervis,2013–2014,7.0,83.0,7.3,1800.0,"Galip Dervis, is an adapted version of the Monk series.",2.0,3.0,Birce Akalay,Sarp Akkaya,Ebru Cündübeyoglu,30.0,2013,1,3,10.0,0,0,0,0,0,1,0,0,0,0,0,0,0,0,0,0,0,0,0,0,0,0,0,1,1,0,0
491,496,Maske: Kimsin Sen?,2022,7.0,83.0,6.3,170000.0,Unknown,1.0,2.0,Bensu Soral,Kubilay Aka,Utku Ates,8.0,2022,0,2,4.0,0,0,0,0,0,0,0,0,0,0,0,1,0,0,0,0,0,0,0,0,0,0,0,0,1,0,0
492,497,Hayat Agaci,2014,7.0,83.0,5.5,373000.0,"The shops of the Karahanli Family burn down one night. Murat works hard to tidy up the shop and put things right, but he is unaware of the danger that awaits them.",1.0,2.0,Onur Sirin,Yigit Kirazci,Sahra Sas,24.0,2014,0,2,12.0,0,0,0,0,0,0,0,1,0,0,0,0,0,0,0,0,0,0,0,0,0,1,0,0,0,0,0
