,Unnamed: 0,Name,Years,Age,Duration,Rating,VoteCount,Summary,Review_Count,Seasons,Star1,Star2,Star3,EpisodeCount,baslangic,isFinal,Sınıf,EpsPerSeason,Action,Adventure,Animation,Biography,Comedy,Crime,Documentary,Drama,Family,Game-Show,History,Music,News,Reality-TV,Romance,Sci-Fi,Short,Sport,Talk-Show,others,HasLove,HasFamily,HasIstanbul,Basrol_Class1,Basrol_Class2,Basrol_Class3,Basrol_Class4
0,0,Kus Uçusu,2022– ,7.0,45.0,6.4,5700.0,"A young fan maneuvers her way into a seasoned anchor's newsroom but soon confronts the dark side of ambition, envy and the desire to be seen.",22.5,2.0,Birce Akalay,Miray Daner,Ibrahim Celikkol,16.0,2022,0,2,8.0,0,0,0,0,0,0,0,1,0,0,0,0,0,0,0,0,0,0,0,0,0,1,0,0,1,0,0
1,1,Sahsiyet,2018– ,7.0,60.0,9.0,46000.0,A man diagnosed with Alzheimer's decides to punish criminals.,22.5,2.0,Haluk Bilginer,Sebnem Bozoklu,Recep Usta,21.0,2018,0,2,10.0,0,0,0,0,0,1,0,0,0,0,0,0,0,0,0,0,0,0,0,0,0,0,0,0,0,0,1
2,2,Yabani,2023– ,7.0,83.0,7.3,513749.99999999977,"The life of a young boy named Yaman growing up on the streets, along with his friends, as they face challenges of survival.",14.0,2.0,Halit Özgür Sari,Simay Barlas,Yurdaer Okur,17.0,2023,0,2,8.0,0,0,0,0,0,0,0,1,0,0,0,0,0,0,0,0,0,0,0,0,0,0,0,1,1,0,0
3,3,Aile,2023– ,7.0,83.0,6.6,2200.0,"Aile is a story of Aslan who is the son of a large family, runs a nightclub. An extremely shrewd man. He is a dark and mysterious character. Psychologist Devin will enter the life of this difficult man and it becomes intense.",15.0,2.0,Kivanç Tatlitug,Serenay Sarikaya,Nur Sürer,27.0,2023,0,2,14.0,1,0,0,0,0,0,0,0,0,0,0,0,0,0,0,0,0,0,0,0,0,1,0,0,0,0,0
4,4,Gibi,2021– ,7.0,30.0,9.0,20000.0,Yilmaz and Ilkkan are two friends who are constantly fighting each other. Their greatest feature is always being able to do something that will turn their ordinary lives upside down.,22.5,4.5,Feyyaz Yigit,Kivanç Kilinç,Ahmet Kürsat Öçalan,43.0,2021,0,3,9.0,0,0,0,0,1,0,0,0,0,0,0,0,0,0,0,0,0,0,0,0,0,0,0,0,0,0,0
5,5,Sen Çal Kapimi,2020–2021,7.0,120.0,7.3,15000.0,"Due to circumstances, Serkan and Eda will have to pretend to be engaged. Comedy begins. And romance?",22.5,2.0,Hande Erçel,Kerem Bürsin,Evrim Dogan,52.0,2020,1,2,26.0,0,0,0,0,1,0,0,0,0,0,0,0,0,0,0,0,0,0,0,0,0,0,0,0,1,0,0
6,6,Çukur,2016–2021,7.0,120.0,7.6,19000.0,"A dangerous neighborhood, ""The Pit"", ran by a noble mafia family called Koçovali. When the family is in the danger of losing the control of The Pit, their youngest son now must come back to his home, where he could never escape from.",22.5,4.0,Aras Bulut Iynemli,Erkan Kolçak Köstendil,Riza Kocaoglu,101.0,2016,1,3,33.0,1,0,0,0,0,0,0,0,0,0,0,0,0,0,0,0,0,0,0,0,0,1,0,1,0,0,0
7,7,Yali Çapkini,2022– ,7.0,83.0,6.2,4300.0,"Halis Aga, the pillar of one of Gaziantep's well-established families, decides to marry off his unruly grandson Ferit to bring him into line.",22.5,2.0,Afra Saraçoglu,Mert Ramazan Demir,Gülçin Santircioglu,52.0,2022,0,2,26.0,0,0,0,0,0,0,0,1,0,0,0,0,0,0,0,0,0,0,0,0,0,1,0,0,0,0,0
8,8,Kurulus: Osman,2019– ,7.0,120.0,7.6,12000.0,"The series will focus on the life of Osman Bey, the son of Ertugrul Gazi and the founder of the Ottoman Empire.",22.5,4.5,Mehmet Bozdag,,,101.0,2019,0,3,28.0,1,0,0,0,0,0,0,0,0,0,0,0,0,0,0,0,0,0,0,0,0,1,0,0,0,0,0
9,9,Atatürk 1881 - 1919,2023–2024,7.0,83.0,7.2,67000.0,"The life story of Veteran Mustafa Kemal Atatürk, the founding father of the Republic of Turkey and its first President, supreme commander of Turkish War of Independence, and revolutionary statesman.",16.0,2.0,Aras Bulut Iynemli,Lidija Kordic,Alican Barlas,3.0,2023,1,2,2.0,0,0,0,1,0,0,0,0,0,0,0,0,0,0,0,0,0,0,0,1,0,1,0,0,0,0,0
10,10,Yargi,2021– ,7.0,150.0,8.4,4900.0,Follows how a fearless lawyer and a renowned prosecutor meet during a crime investigation.,22.5,3.0,Kaan Urgancioglu,Pinar Deniz,Hüseyin Avni Danyal,80.0,2021,0,3,27.0,0,0,0,0,0,1,0,0,0,0,0,0,0,0,0,0,0,0,0,0,0,0,0,0,0,1,0
11,11,Terzi,2023,7.0,45.0,6.2,5000.0,A famous tailor begins to sew a wedding dress for his best friend's fiance- but all three have dark secrets that will soon upend their lives.,22.5,3.0,Onur Güvenatam,,,23.0,2023,0,3,8.0,0,0,0,0,0,0,0,1,0,0,0,0,0,0,0,0,0,0,0,0,0,0,0,0,0,0,0
12,12,Hudutsuz Sevda,2023– ,7.0,83.0,6.6,464000.0,The series followed Halil Ibrahim as he seeks revenge for the death of the love of his life. His plans are derailed when he meets Zeynep from the Leto family.,4.0,2.0,Deniz Can Aktas,Miray Daner,Esra Dermancioglu,14.0,2023,0,2,7.0,1,0,0,0,0,0,0,0,0,0,0,0,0,0,0,0,0,0,0,0,1,1,0,0,0,0,0
13,13,Kizilcik Serbeti,2022– ,7.0,83.0,6.7,1200.0,A love story between two extreme families with the same truth but different methods.,18.0,2.0,Baris Kilic,Evrim Alasya,Sila Turkoglu,42.0,2022,0,2,21.0,0,0,0,0,0,0,0,1,0,0,0,0,0,0,0,0,0,0,0,0,1,0,0,1,0,0,0
14,14,Çekiç ve Gül: Bir Behzat Ç. Hikayesi,2022– ,7.0,83.0,8.6,2400.0,"The story is a Turkish-made detective, drama, adventure, comedy, thriller and action internet series, inspired by Emrah Serbes' novel of the same name, Çekiç ve Gül.",4.0,2.0,Erdal Besikçioglu,Inanç Konukçu,Berkan Sal,12.0,2022,0,2,6.0,1,0,0,0,0,0,0,0,0,0,0,0,0,0,0,0,0,0,0,0,0,0,0,0,0,0,0
15,15,Ilk Ve Son,2021,7.0,60.0,8.1,2200.0,"The story of Deniz and Baris' relationship for 10 years. The two young men who met in their mid 20's, until the day they divorced; a love story sometimes sunny, cloudy, stormy, possible and impossible.",7.0,2.0,Özge Özpirinçci,Salih Bademci,Gulcin Kultur Sahin,8.0,2021,0,2,4.0,0,0,0,0,0,0,0,1,0,0,0,0,0,0,0,0,0,0,0,0,1,0,0,1,1,0,0
16,16,Kara Sevda,2015–2017,7.0,90.0,7.4,9800.0,A young artist finds herself obligated to sacrifice her love story for hiding a family secret.,22.5,2.0,Burak Özçivit,Neslihan Atagül,Kaan Urgancioglu,89.0,2015,1,2,44.0,0,0,0,0,0,0,0,1,0,0,0,0,0,0,0,0,0,0,0,0,1,1,0,0,0,0,0
17,17,The Protector,2018–2020,7.0,40.0,6.5,36000.0,"Discovering his ties to a secret ancient order, a young man living in modern Istanbul embarks on a quest to save the city from an immortal enemy.",22.5,4.0,Binnur Karaevli,,,32.0,2018,1,3,8.0,1,0,0,0,0,0,0,0,0,0,0,0,0,0,0,0,0,0,0,0,0,0,1,0,0,0,0
18,18,Bambaska Biri,2023,7.0,130.0,7.2,2100.0,"The brutal murder of Hamdi Atilbay brings together the paths of young prosecutor Leyla, and a famous journalist Kenan. However, this murder is covered with facts that will also destroy their love.",22.5,3.0,Burak Deniz,Hande Erçel,Cem Davran,15.0,2023,0,3,5.0,0,0,0,0,0,1,0,0,0,0,0,0,0,0,0,0,0,0,0,0,1,0,0,0,1,0,0
19,20,Siyah Beyaz Ask,2017–2018,7.0,140.0,8.0,7900.0,A doctor who has devoted herself to healing others encounters a cold-blooded killer with a wounded past. What happens when the woman who saves lives is captured by the man who takes them?,22.5,2.0,Ibrahim Celikkol,Birce Akalay,Muhammet Uzuner,32.0,2017,1,2,16.0,1,0,0,0,0,0,0,0,0,0,0,0,0,0,0,0,0,0,0,0,0,0,0,0,1,0,0
20,21,Adim Farah,2023,7.0,83.0,6.4,3200.0,Farah is a 28-year-old Iranian doctor who works illegally as a cleaner in Istanbul and witnesses a murder committed by the mafia.,22.5,2.0,Engin Akyürek,Demet Özdemir,Firat Tanis,27.0,2023,0,2,14.0,1,0,0,0,0,0,0,0,0,0,0,0,0,0,0,0,0,0,0,0,0,0,1,1,1,0,0
21,22,Ezel,2009–2011,7.0,90.0,8.7,36000.0,"Betrayed by his trusted friends and the woman he loved, Ömer Uçar returns as Ezel to exact his vengeance.",22.5,2.0,Kenan Imirzalioglu,Cansu Dere,Yigit Özsener,71.0,2009,1,2,36.0,0,0,0,0,0,1,0,0,0,0,0,0,0,0,0,0,0,0,0,0,1,0,0,1,0,0,0
22,23,Kurtlar Vadisi,2003–2005,7.0,60.0,7.9,20000.0,Follows a Turkish agent working under the assumed identity of Polat Alemdar attempting to infiltrate the Turkish mafia.,22.5,4.0,Necati Sasmaz,Özgü Namal,Gürkan Uygun,97.0,2003,1,3,24.0,1,0,0,0,0,0,0,0,0,0,0,0,0,0,0,0,0,0,0,0,0,0,0,1,0,0,0
23,24,Ask-i Memnu,2008–2010,7.0,90.0,7.7,15000.0,"Rich Adnan marries Bihter, who is younger than him. A poisonous forbidden love begins between Adnan's nephew Behlül and Bihter who lives in the same mansion.",22.5,2.0,Beren Saat,Kivanç Tatlitug,Nebahat Çehre,79.0,2008,1,2,40.0,0,0,0,0,0,0,0,1,0,0,0,0,0,0,0,0,0,0,0,0,1,1,0,0,1,0,0
24,25,Dirilis: Ertugrul,2014–2019,7.0,120.0,7.9,39000.0,"The heroic story of Ertugrul Ghazi, the father of Osman (Uthman) who founded the Ottoman Empire.",22.5,4.5,Müjde Ar,Sükran Güngör,Itir Esen,6.0,2014,1,3,1.0,1,0,0,0,0,0,0,0,0,0,0,0,0,0,0,0,0,0,0,0,0,1,0,0,0,0,0
25,26,Prens,2023– ,7.0,83.0,8.0,2100.0,"Bongomia is a country that no one cares about, in a history that no one cares about. After the sudden and suspicious death of Thun, king of Bongomia, a complicated story begins when the Prince, whom no one takes seriously and whose family does not even bother to name, comes to the throne.",7.0,2.0,Beren Saat,Kivanç Tatlitug,Nebahat Çehre,79.0,2023,0,2,40.0,0,0,0,0,1,0,0,0,0,0,0,0,0,0,0,0,0,0,0,0,0,1,0,0,1,0,0
26,27,Kiralik Ask,2015–2017,7.0,120.0,7.3,9500.0,"When Defne's brother gets into debt and is held captive, Defne is forced to accept an offer in exchange for the money. She has to make Omer, a wealthy shoe designer who owns a company, fall in love with her and marry her.",22.5,2.0,Müjde Ar,Sükran Güngör,Itir Esen,6.0,2015,1,2,3.0,0,0,0,0,1,0,0,0,0,0,0,0,0,0,0,0,0,0,0,0,1,0,0,0,0,0,0
27,28,Behzat Ç.: Bir Ankara Polisiyesi,2010–2019,7.0,90.0,8.9,32000.0,An inharmonious police team in Ankara Police Force and its discredited police chief fight crime.,22.5,4.0,Mehmet Bozdag,,,101.0,2010,1,3,45.0,0,0,0,0,0,1,0,0,0,0,0,0,0,0,0,0,0,0,0,0,0,0,0,0,0,0,0
28,29,Arak,2023– ,7.0,83.0,6.6,82000.0,"In 1998, Elif Çinar, the wife of Rauf Çinar, one of the country's leading economics professors, is stabbed by a burglar named Necip Talan. The lives of these two families from completely different worlds change after that night.",2.0,2.0,Giray Altinok,Derya Pinar Ak,Çagdas Onur Öztürk,8.0,2023,0,2,4.0,0,0,0,0,0,0,0,1,0,0,0,0,0,0,0,0,0,0,0,0,0,1,0,0,0,0,0
29,30,Leyla ile Mecnun,2011–2023,7.0,80.0,9.1,96000.0,"It is an unique and heartwarming show follows the extraordinary journey of a couple named Leyla and Mecnun. With Ali Atay portraying Mecnun and Ezgi Asaroglu as Leyla, the series has garnered a massive fan base and critical acclaim.",22.5,4.5,Elçin Sangu,Baris Arduç,Salih Bademci,69.0,2011,1,4,10.0,0,1,0,0,0,0,0,0,0,0,0,0,0,0,0,0,0,0,0,0,0,0,0,0,1,0,0
30,31,Erkenci Kus,2018–2019,7.0,120.0,7.4,10000.0,"Famous photographer Can Divit returns to Istanbul to save his family's advertising agency from ruin. The only person he trusts there is Sanem, a young aspiring writer. She is not convinced in his honesty, but soon falls for his charm.",22.5,2.0,Erdal Besikçioglu,Inanç Konukçu,Ege Aydan,101.0,2018,1,2,45.0,0,0,0,0,1,0,0,0,0,0,0,0,0,0,0,0,0,0,0,0,0,1,1,0,0,1,0
31,32,Eskiya Dünyaya Hükümdar Olmaz,2015–2021,7.0,83.0,6.8,2800.0,The series tells the life of Hizir Cakirbeyli. It has entered the realm of the mafia at a young age.,4.0,4.5,Ilker Kaleli,Öykü Karayel,Demircan Kacel,2.0,2015,1,4,0.0,1,0,0,0,0,0,0,0,0,0,0,0,0,0,0,0,0,0,0,0,0,0,0,0,1,0,0
32,33,Kulüp,2021–2023,7.0,55.0,7.8,11000.0,"In cosmopolitan 1950s Istanbul, a mother with a troubled past works at a nightclub to reconnect with and help the rebellious daughter she couldn't raise.",22.5,2.0,Ali Atay,Serkan Keskin,Osman Sonant,101.0,2021,1,2,45.0,0,0,0,0,0,0,0,1,0,0,0,0,0,0,0,0,0,0,0,0,0,1,1,1,0,0,0
33,34,Kara Para Ask,2014–2015,7.0,90.0,7.6,7600.0,"Omar is a police officer. After the death of his fiancé he suffers great pain. Sibel, Omar's fiancée's body was found on the top of a cliff, in a car next to a fairly old, rich business man. After the shock of her sudden death and the accusations of his love cheating on him, Omar realizes that there is more behind her suspicious murder.",22.5,2.0,Demet Özdemir,Can Yaman,Öznur Serçeler,51.0,2014,1,2,26.0,1,0,0,0,0,0,0,0,0,0,0,0,0,0,0,0,0,0,0,0,1,0,0,1,1,0,0
34,35,Sandik Kokusu,2023– ,7.0,83.0,5.5,81000.0,"It is a hopeful story of a family starting over in Adana and extending to Istanbul, with an impressive atmosphere.",4.0,2.0,Oktay Kaynarca,Yunus Emre Yildirimer,Ozan Akbaba,101.0,2023,0,2,45.0,0,0,0,0,0,0,0,1,0,0,0,0,0,0,0,0,0,0,0,0,0,1,1,0,0,1,0
35,36,Muhtesem Yüzyil: Kösem,2015–2017,7.0,83.0,6.6,3900.0,"Anastasia a young Greek woman in Ahmed I's harem takes on the name 'Kosem' (leader, pioneer). In a world of men, she rules of the Ottoman Empire through her sons and grandson.",20.0,2.0,Zeynep Gunay Tan,,,20.0,2015,1,2,10.0,0,0,0,0,0,0,0,1,0,0,0,0,0,0,0,0,0,0,0,0,0,1,0,0,0,0,0
36,37,Sahmaran,2023– ,7.0,60.0,5.2,6700.0,"When Sahsu goes to Adana for a lecture, it's the perfect chance to face her estranged grandfather. But soon, she finds herself in the midst of a legend.",22.5,3.0,Tuba Büyüküstün,Engin Akyürek,Burak Tamdogan,54.0,2023,0,3,18.0,0,1,0,0,0,0,0,0,0,0,0,0,0,0,0,0,0,0,0,0,0,1,0,1,0,0,0
37,38,Kudüs Fatihi Selahaddin Eyyubi,2023– ,7.0,83.0,5.2,513749.99999999977,"The life of Muslim ruler Saladin and he conquered Jerusalem. Furthermore, it focuses on his battles against the Crusaders and his goal to unite the Muslim territories of Syria, northern Mesopotamia, Palestine and Egypt under his rule.",16.0,2.0,Özge Özpirinçci,Demet Akbag,Necip Memili,2.0,2023,0,2,1.0,1,0,0,0,0,0,0,0,0,0,0,0,0,0,0,0,0,0,0,0,0,0,0,1,0,0,0
38,39,Günesi Beklerken,2013–2014,7.0,83.0,6.9,4700.0,"Looking for a better life, Demet tries to convince her only daughter Zeynep to leave their home village. They move into Demet's old friend's house Jale, and Zeynep is able to enroll at the same private college as where Jale works as the principal.",8.0,2.0,Hakan Sahin,Sener Savas,Nurgül Yesilçay,60.0,2013,1,2,30.0,0,0,0,0,0,0,0,1,0,0,0,0,0,0,0,0,0,0,0,0,0,1,0,0,0,0,0
39,40,Muhtesem Yüzyil,2011–2014,7.0,90.0,6.9,19000.0,"From 1520, follows Suleiman the Magnificent and his relatives from his great conquests to the ""Battle of Szigeth"".",22.5,4.0,Serenay Sarikaya,Burak Deniz,Mustafa Ugurlu,10.0,2011,1,3,2.0,0,0,0,1,0,0,0,0,0,0,0,0,0,0,0,0,0,0,0,1,0,0,0,0,0,0,0
40,41,Içerde,2016–2017,7.0,60.0,8.1,20000.0,"A story of two brothers torn from each other. Now on the opposite sides of the law, brothers Sarp and Mert are put against each other, unaware of their fraternity.",22.5,2.0,Ugur Günes,Dilin Doger,Mehmet Ali Nuroglu,5.0,2016,1,2,2.0,1,0,0,0,0,0,0,0,0,0,0,0,0,0,0,0,0,0,0,0,0,0,0,0,0,0,0
41,42,Hercai,2019–2021,7.0,120.0,6.6,4000.0,Miran is seeking revenge for his parents death so he plans to marry daughter Reyyan from the family who were responsible for that. Unexpectedly he falls in love with Reyyan. Will this change the plan?,22.5,3.0,Kerem Bürsin,Hande Dogandemir,Yagmur Tanrisevsin,54.0,2019,1,3,18.0,0,0,0,0,0,0,0,1,0,0,0,0,0,0,0,0,0,0,0,0,1,1,0,0,0,0,0
42,43,Biz Kimden Kaçiyorduk Anne?,2023,7.0,45.0,5.8,3900.0,"Hiding a mysterious past, a mother lives like a nameless fugitive with her daughter as they make hotels their home and see everyone else as a threat.",22.5,3.0,Halit Ergenç,Nur Fettahoglu,Selim Bayraktar,101.0,2023,0,3,45.0,0,0,0,0,0,1,0,0,0,0,0,0,0,0,0,0,0,0,0,0,0,1,0,0,0,0,0
43,44,Vatanim Sensin,2016–2018,7.0,120.0,8.4,5300.0,"During the occupation of Izmir by the Greeks, a Turkish soldier starts to work for the enemy. But he is not really on the side of the enemy. He must keep this secret at the cost of losing his family.",20.0,2.0,Çagatay Ulusoy,Aras Bulut Iynemli,Çetin Tekindor,39.0,2016,1,2,20.0,0,0,0,0,0,0,0,1,0,0,0,0,0,0,0,0,0,0,0,0,0,1,0,0,0,1,0
44,45,Yasak Elma,2018–2023,7.0,120.0,5.8,2700.0,"Three things in life can not be hidden ""love, smoke and lack of money"". The social society and the events behind the business world are told.",22.5,4.5,Akin Akinözü,Ebru Sahin,Ayda Aksel,81.0,2018,1,4,14.0,0,0,0,0,0,0,0,1,0,0,0,0,0,0,0,0,0,0,0,0,1,0,0,0,0,1,0
45,46,Zeytin Agaci,2022– ,7.0,50.0,6.6,6900.0,Three close friends set off on a journey to Ayvalik and then to their reshaped future.,22.5,2.0,Melisa Sözen,Eylül Tumbar,Musa Uzunlar,7.0,2022,0,2,4.0,0,0,0,0,0,0,0,1,0,0,0,0,0,0,0,0,0,0,0,0,0,0,0,1,0,1,0
46,47,Ayak Isleri,2021–2023,7.0,20.0,8.4,4400.0,"Experienced missionary Vedat and philosophy-educated, politically correct Evren are the duo assigned to the 'extremely important' errands of a wealthy businessman. This discordant duo, one of whom closes his eyes and does his duty, questions his name, embarks on another adventure. But more they conflict within themselves than they do on duty.",6.0,3.0,Halit Ergenç,Bergüzar Korel,Boran Kuzum,60.0,2021,1,3,20.0,1,0,0,0,0,0,0,0,0,0,0,0,0,0,0,0,0,0,0,0,0,0,0,0,1,0,0
47,48,Safir,2023– ,7.0,83.0,6.3,513749.99999999977,"Yaman and Feraye, who have kept a great love hidden from everyone since childhood, have very little time left before they are reunited again.",6.0,2.0,Sevval Sam,Eda Ece,Baris Aytac,101.0,2023,0,2,45.0,0,0,0,0,0,0,0,1,0,0,0,0,0,0,0,0,0,0,0,0,1,0,0,0,0,0,0
48,49,Ask 101,2020–2021,7.0,40.0,7.4,17000.0,"In 1990s Turkey, a group of teenage outcasts band together to make their beloved teacher fall in love so she'll have a reason to stay in town with them.",22.5,2.0,Nuran Evren Sit,,,8.0,2020,1,2,4.0,0,0,0,0,1,0,0,0,0,0,0,0,0,0,0,0,0,0,0,0,1,1,0,0,0,0,0
49,50,Kurtlar Vadisi: Pusu,2007–2016,7.0,83.0,6.2,9100.0,"Valley of the Wolves, the legendary action drama, centers around Polat Alemdar and follows his journey to serve his country by trying to uncover the truth and defeating the secret enemies aka the controllers of the global power.",6.0,4.5,Çaglar Çorumlu,Güven Murat Akpinar,Cagla Irmak,30.0,2007,1,4,3.0,1,0,0,0,0,0,0,0,0,0,0,0,0,0,0,0,0,0,0,0,0,0,0,0,0,0,0
50,51,Sakla Beni,2023– ,7.0,83.0,4.7,287000.0,"An encounter between Incila, Naz's despised assistant and Mete begins to change the direction of Naz's future, where she plans everything with Mete with a toxic passion.",5.0,2.0,Ilhan Sen,Özge Yagiz,Burak Berkay Akgül,17.0,2023,0,2,8.0,0,0,0,0,0,0,0,1,0,0,0,0,0,0,0,0,0,0,0,0,0,0,0,0,0,0,0
51,52,Fi,2017–2018,7.0,60.0,7.8,12000.0,"The story of those who pursue passion, those who fly at the expense of burning and those who stand up against life in pain.",22.5,2.0,Meriç Acemi,,,16.0,2017,1,2,8.0,0,0,0,0,0,0,0,1,0,0,0,0,0,0,0,0,0,0,0,0,0,0,0,0,0,0,0
52,53,Destan,2021–2022,7.0,130.0,7.3,1600.0,"The epic love story of Akkiz, a warrior mountain girl, and disabled Prince Batuga, who were both orphaned by Gök Han in the 8th century in the harsh steppes of Central Asia.",22.5,2.0,Necati Sasmaz,Erhan Ufak,Cahit Kayaoglu,101.0,2021,1,2,45.0,1,0,0,0,0,0,0,0,0,0,0,0,0,0,0,0,0,0,0,0,1,0,0,0,0,0,0
53,54,Aynen Aynen,2019–2021,7.0,83.0,7.5,4700.0,The series tells the story of Deniz and Nil's entertaining relationship by explaining the relationship between men and women in a humorous as well as realistic language. We see the situations in which Nil and Deniz want to show themselves to the other party in the relationship and in fact their own real thoughts.,13.0,4.5,Uraz Kaygilaroglu,Cemre Baysel,Asude Kalebek,7.0,2019,1,4,1.0,0,0,0,0,0,0,0,0,0,0,0,0,0,0,0,0,1,0,0,1,0,0,0,0,0,0,0
54,55,Ya Çok Seversen,2023,7.0,83.0,6.8,3200.0,"Ates was sent to boarding school after his mother's death and never returned home. He trusts no one. Leyla, on the other hand, has never known her family and earns money by cheating. What will happen when they cross paths?",22.5,2.0,Ozan Güven,Serenay Sarikaya,Mehmet Günsür,22.0,2023,0,2,11.0,0,0,0,0,1,0,0,0,0,0,0,0,0,0,0,0,0,0,0,0,0,1,0,1,0,0,0
55,56,Mucize Doktor,2019–2021,7.0,120.0,7.1,3400.0,"A distinguished surgical unit turns upside down when a strange new resident joins the team. Ali has Savant syndrome, making it hard for him to communicate with other people, even though he is a phenomenal doctor.",22.5,2.0,Ebru Sahin,Edip Tepeli,Selim Bayraktar,28.0,2019,1,2,14.0,0,0,0,0,0,0,0,1,0,0,0,0,0,0,0,0,0,0,0,0,0,0,0,0,0,0,0
56,57,Kübra,2024– ,7.0,83.0,5.4,81000.0,"Follows Gökhan Ahinolu, whose connection with his girlfriend is strained after he gets a message from a user named Kübra. Everything will alter due to this communication, and something unexpected will happen.",4.0,2.0,Nilperi Sahinkaya,Kerem Bürsin,Uraz Kaygilaroglu,44.0,2024,0,2,22.0,0,0,0,0,0,0,0,1,0,0,0,0,0,0,0,0,0,0,0,0,0,0,0,0,0,0,0
57,58,Atiye,2019–2021,7.0,40.0,7.0,24000.0,A painter in Istanbul embarks on a personal journey as she unearths universal secrets about an Anatolian archaeological site and its link to her past.,22.5,3.0,Kerem Bürsin,Hafsanur Sancaktutan,Hatice Aslan,13.0,2019,1,3,4.0,0,0,0,0,0,0,0,1,0,0,0,0,0,0,0,0,0,0,0,0,0,1,1,0,1,0,0
58,59,Son Yaz,2021,7.0,120.0,8.0,3600.0,"Idealist Public Prosecutor Selim receives an offer he cannot refuse from organized crime leader Selcuk Taskin, whom he sent to prison. Selcuk will testify in the prosecutor's case, but in return, he asks the prosecutor to protect his son.",22.5,2.0,Taner Ölmez,Onur Tuna,Sinem Ünsal,64.0,2021,0,2,32.0,1,0,0,0,0,0,0,0,0,0,0,0,0,0,0,0,0,0,0,0,0,1,0,0,1,0,0
59,60,Yakamoz S-245,2022,7.0,45.0,6.2,8200.0,"After disaster strikes Earth, a marine biologist on a submarine research mission must fight to survive with the crew as a conspiracy comes to light.",22.5,2.0,Çagatay Ulusoy,Ahsen Eroglu,Aslihan Malbora,1.0,2022,0,2,0.0,1,0,0,0,0,0,0,0,0,0,0,0,0,0,0,0,0,0,0,0,0,0,0,0,0,0,0
60,61,Kuzgun,2019,7.0,120.0,7.9,3800.0,"Kuzgun's family life changes completely as a result of the caliper held against his father, who is a police. Kuzgun will fall into a bondage, pain, anger, and struggle that will last 20 years.",22.5,2.0,Beren Saat,Mehmet Günsür,Melisa Senolsun,24.0,2019,0,2,12.0,1,0,0,0,0,0,0,0,0,0,0,0,0,0,0,0,0,0,0,0,0,1,0,1,1,0,0
61,62,Ask Mantik Intikam,2021–2022,7.0,120.0,6.7,2500.0,"A couple gets divorced after several years of marriage. After that, the man suddenly gets rich, and life changes again when his ex-wife starts working with him.",22.5,2.0,Alperen Duymaz,Ali Atay,Hafsanur Sancaktutan,26.0,2021,1,2,13.0,0,0,0,0,1,0,0,0,0,0,0,0,0,0,0,0,0,0,0,0,0,1,0,1,1,0,0
62,63,Dogu,2021– ,7.0,30.0,7.3,3900.0,"Dogu is a young man who is not successful in anything. The dream of Dogu, which is not supported by anyone, is to be a comedian. He strives to make his dream come true.",11.0,2.0,Kivanç Tatlitug,Jerry Hoffmann,Ecem Uzun,7.0,2021,0,2,4.0,0,0,0,0,1,0,0,0,0,0,0,0,0,0,0,0,0,0,0,0,0,0,0,0,1,0,0
63,64,Alparslan: Büyük Selçuklu,2021–2023,7.0,120.0,7.7,2300.0,"The TRT production is a prequel story of Awakening: the Great Seljuk. It depicts the life and triumphs of Sultan Alparslan, the second sultan of the Seljuk dynasty, whose victories expanded the empire in the 11th century.",22.5,2.0,Baris Arduç,Burcu Biricik,Hatice Aslan,21.0,2021,1,2,10.0,1,0,0,0,0,0,0,0,0,0,0,0,0,0,0,0,0,0,0,0,0,0,0,0,1,0,0
64,65,Kardeslerim,2021– ,7.0,120.0,6.0,1900.0,4 siblings have to struggle with life after their parents' death.,22.5,4.0,Burcu Özberk,Ilhan Sen,Mehmet Korhan Firat,50.0,2021,0,3,12.0,0,0,0,0,0,0,0,1,0,0,0,0,0,0,0,0,0,0,0,0,0,0,0,0,1,0,0
65,66,Muhtesem Ikili,2018–2019,7.0,120.0,6.7,3500.0,"Muhtesem Ikili is an adaption of the famous American movie, Tango and Cash. A story of two police officer Mert Barca and Mustafa Kerim Can / MKC. Barca and MKC, are forced to come together for a drug operation.",22.5,2.0,Dogu Demirkol,Evliya Aykan,Banu Fotocan,16.0,2018,1,2,8.0,1,0,0,0,0,0,0,0,0,0,0,0,0,0,0,0,0,0,0,0,0,0,0,0,0,0,0
66,67,Seref Meselesi,2014–2015,7.0,83.0,7.2,3700.0,Follow the Kilic brothers as they take different paths in life after moving from the tiny Ayvalik to the vibrant Istanbul.,18.0,2.0,Baris Arduç,Aysegül Ünsal,Kutay Sungar,61.0,2014,1,2,30.0,0,0,0,0,0,0,0,1,0,0,0,0,0,0,0,0,0,0,0,0,0,0,1,0,0,0,0
67,68,Bir Derdim Var,2023,7.0,83.0,7.3,178000.0,"Dr. Nilüfer is constantly pursuing a secret that could jeopardize her work, which will lead to a major conflict with the inflexible prosecutor Ömer (Mert Firat).",4.0,2.0,Celil Nalçakan,Fadik Sevin Atasoy,Simge Selçuk,101.0,2023,0,2,45.0,0,0,0,0,0,0,0,1,0,0,0,0,0,0,0,0,0,0,0,0,0,0,0,1,0,0,0
68,69,Günesin Kizlari,2015–2016,7.0,120.0,5.9,3300.0,Gunes is a 35 years old woman and a literature teacher whose husband left her with no reason. So she decides to get married in order to afford a good future for her three daughters.,22.5,2.0,Ibrahim Celikkol,Kerem Bürsin,Özge Gürel,12.0,2015,1,2,6.0,0,0,0,0,1,0,0,0,0,0,0,0,0,0,0,0,0,0,0,0,0,1,0,0,1,0,0
69,70,Çarpisma,2018–2019,7.0,120.0,7.5,4800.0,It is about life that intersects with the collision of four cars.,22.5,2.0,Kerem Bürsin,Sükrü Özyildiz,Sükran Ovali,26.0,2018,1,2,13.0,1,0,0,0,0,0,0,0,0,0,0,0,0,0,0,0,0,0,0,0,0,0,0,0,0,0,0
70,71,Sila,2006–2008,7.0,83.0,5.3,1600.0,A young woman's forced marriage to the agha of a tribe in Southeastern Turkey leads to tragedy and social change.,7.0,3.0,Birce Akalay,Mert Firat,Engin Hepileri,6.0,2006,1,3,2.0,0,0,0,0,0,0,0,1,0,0,0,0,0,0,0,0,0,0,0,0,0,0,0,1,1,0,0
71,72,Kadin,2017–2020,7.0,120.0,6.8,1600.0,"Bahar, a loving mother who struggles to maintain a life with her two children, must deal with life's challenges and uncover the hidden truths of the past.",22.5,3.0,Emre Kinay,Evrim Alasya,Tolga Saritas,39.0,2017,1,3,13.0,0,0,0,0,0,0,0,1,0,0,0,0,0,0,0,0,0,0,0,0,0,1,0,1,0,0,0
72,73,Sadakatsiz,2020–2022,7.0,120.0,6.5,2400.0,"Asya is a successful doctor who has the perfect life with her husband and son. But after she finds a blonde hair on her husband's scarf, she discovers his extramarital affair and everything changes.",20.0,2.0,Kivanç Tatlitug,Elçin Sangu,Alperen Duymaz,24.0,2020,1,2,12.0,0,0,0,0,0,0,0,1,0,0,0,0,0,0,0,0,0,0,0,0,0,1,0,0,1,0,0
73,74,Gülcemal,2023,7.0,83.0,7.2,1300.0,Abandoned by his mother as a boy. A man years later vows to get revenge on the mom and her new family all while unknowingly falling in love with her adopted daughter.,22.5,2.0,Mehmet Akif Alakurt,Cansu Dere,Menderes Samancilar,94.0,2023,0,2,45.0,0,0,0,0,0,0,0,1,0,0,0,0,0,0,0,0,0,0,0,0,1,1,0,1,0,0,0
